統一編號,公司名稱,公司地址,實收資本額,公司狀態,產製日期
53192013,鋐益國際股份有限公司,臺北市中山區民生東路1段42號10樓之10,10000000,核准設立,2020-04-01 02:36:38.997
53205755,咪噠積股份有限公司,新北市新店區民權路95號10樓之5,10000000,核准設立,2020-04-01 02:36:38.997
53209324,樂點股份有限公司,臺北市內湖區瑞湖街111號,150000000,核准設立,2020-04-01 02:36:38.997
53210384,昇雲科技有限公司,新北市樹林區學成路627號13樓,0,核准設立,2020-04-01 02:36:38.997
53217730,金振旺行銷通路有限公司,臺北市文山區興隆路4段30號,0,核准設立,2020-04-01 02:36:38.997
53223563,華盛生醫科技股份有限公司,新北市五股區中興路1段6之1號(1樓),30000000,核准設立,2020-04-01 02:36:38.997
53225247,華東富士建設有限公司,新北市三峽區紫新路16巷16號5樓,null,解散,2020-04-01 02:36:38.997
53232789,易沛網路科技有限公司,臺中市西區公民里五權路1之67號11樓之2,0,核准設立,2020-04-01 02:36:38.997
53233942,華菲絲國際股份有限公司,高雄市鳳山區四維街148號10樓,10000000,核准設立,2020-04-01 02:36:38.997
53234013,豊興有限公司,屏東縣竹田鄉糶糴村三民路159號,0,核准設立,2020-04-01 02:36:38.997
53236321,尚青菜籃子有限公司,高雄市左營區文守路200巷5號1樓,0,核准設立,2020-04-01 02:36:38.997
53236574,大號文創整合公關顧問有限公司,高雄市鹽埕區七賢三路58號3樓,0,核准設立,2020-04-01 02:36:38.997
53237428,洪門國際企業有限公司,高雄市苓雅區復興二路3號9樓之2,0,核准設立,2020-04-01 02:36:38.997
53238616,暢行國際股份有限公司,高雄市苓雅區四維四路216號10樓之2,5000000,解散,2020-04-01 02:36:38.997
53241485,創意島數位科技股份有限公司,高雄市苓雅區海邊路29號6樓之2,26000000,核准設立,2020-04-01 02:36:38.997
53246947,雙大通訊有限公司,高雄市苓雅區中正二路55號1樓,0,核准設立,2020-04-01 02:36:38.997
53255902,老大房國際有限公司,高雄市三民區嫩江街22號1樓,0,核准設立,2020-04-01 02:36:38.997
53259225,采義科技有限公司,臺中市南屯區三和里河南路四段456之12號11樓,0,核准設立,2020-04-01 02:36:38.997
53265079,城市媒體國際有限公司,高雄市鳳山區南正二路64巷103號,0,核准設立,2020-04-01 02:36:38.997
53266751,金億廣告工程有限公司,高雄市梓官區赤崁南路樹人巷81號2樓,0,核准設立,2020-04-01 02:36:38.997
53272162,宸揚資科股份有限公司,臺南市東區富裕里東門路二段297號3樓之1,8600000,核准設立,2020-04-01 02:36:38.997
53274577,高峰企業管理顧問有限公司,臺南市中西區大涼里府前路二段281號7樓,0,核准設立,2020-04-01 02:36:38.997
53278454,紅門互動股份有限公司,臺北市松山區南京東路4段126號11樓之1,19000000,核准設立,2020-04-01 02:36:38.997
53280487,奎澤科技股份有限公司,桃園市桃園區三民里16鄰三民路一段66-1號16樓之4,10000000,解散,2020-04-01 02:36:38.997
53281459,力拓管理顧問有限公司,桃園市大園區中華路234巷40號,null,核准設立,2020-04-01 02:36:38.997
53295600,耘家國際事業有限公司,臺中市西屯區惠來里惠中路二段52號1樓,0,核准設立,2020-04-01 02:36:38.997
53298141,萬寶龍科技有限公司,桃園市桃園區同德五街131巷5弄17號（2樓）,0,核准設立,2020-04-01 02:36:38.997
53306542,鎧豐國際有限公司,新竹縣竹北市興隆路三段329號12樓,0,核准設立,2020-04-01 02:36:38.997
53310258,易渼形象國際股份有限公司,臺北市大安區復興南路1段92之2號1樓,1000000,解散,2020-04-01 02:36:38.997
53313939,暉捷國際顧問有限公司,臺北市大安區光復南路72巷73號3樓,0,核准設立,2020-04-01 02:36:38.997
53315129,速必達國際有限公司,臺北市萬華區成都路67號6樓之1,null,核准設立,2020-04-01 02:36:38.997
53317490,東京都傳媒股份有限公司,臺北市松山區敦化北路170號3樓,8000000,解散,2020-04-01 02:36:38.997
53317864,東朝影藝事業股份有限公司,臺北市信義區信義路4段460號18樓,8000000,解散,2020-04-01 02:36:38.997
53318316,崴秀股份有限公司,臺北市萬華區開封街2段32號6樓,7000000,核准設立,2020-04-01 02:36:38.997
53318857,墨鈞國際有限公司,新北市樹林區三龍街80巷29號,0,核准設立,2020-04-01 02:36:38.997
53319384,大象生活事業有限公司,臺北市大安區忠孝東路4段169號6樓之1,0,核准設立,2020-04-01 02:36:38.997
53321945,書途文旅志業有限公司,臺北市內湖區康樂街186巷34之2號12樓之1,0,核准設立,2020-04-01 02:36:38.997
53322037,泰德聯合投資顧問有限公司,新北市淡水區學府路136巷53號8樓之7,0,核准設立,2020-04-01 02:36:38.997
53322705,聯款通股份有限公司,臺北市松山區南京東路5段188號6樓之5,1000000,核准設立,2020-04-01 02:36:38.997
53322727,信孚貿易有限公司,臺北市中山區南京東路1段16號6樓之9,null,核准設立,2020-04-01 02:36:38.997
53331556,威力仕網通科技有限公司,臺北市大安區和平東路1段200號4樓,0,核准設立,2020-04-01 02:36:38.997
53337123,誠舍國際有限公司,臺北市中正區寧波西街40巷3號3樓之1,0,核准設立,2020-04-01 02:36:38.997
53340226,良賈商行有限公司,臺北市松山區光復南路49號,0,核准設立,2020-04-01 02:36:38.997
53342505,微風置地股份有限公司,臺北市信義區忠孝東路5段68號6樓,1050000000,核准設立,2020-04-01 02:36:38.997
53356021,叡廷股份有限公司,臺北市內湖區瑞光路223號3樓,10000000,核准設立,2020-04-01 02:36:38.997
53356789,均鴻生技有限公司,臺北市信義區忠孝東路4段563號10樓,0,解散,2020-04-01 02:36:38.997
53357648,無規則創意整合行銷有限公司,臺北市內湖區陽光路161巷12號2樓,0,核准設立,2020-04-01 02:36:38.997
53358219,青禾社會企業股份有限公司,臺北市松山區民生東路4段133號4樓,10000000,核准設立,2020-04-01 02:36:38.997
53359364,昕昕創意整合行銷有限公司,花蓮縣花蓮市國治里民國路36-3號2樓,0,核准設立,2020-04-01 02:36:38.997
53372325,政亮企業股份有限公司,桃園市龜山區山福里頂興路64巷6號,25000000,核准設立,2020-04-01 02:36:38.997
53374626,聯亭餐飲有限公司,臺中市西區公正里精誠路338號,0,核准設立,2020-04-01 02:36:38.997
53374962,普羅文化股份有限公司,南投縣埔里鎮西門里北辰街117號三樓,25000000,核准設立,2020-04-01 02:36:38.997
53376080,昱誠智能服務股份有限公司,臺中市北屯區平安里文心路四段696號23樓之2,8000000,核准設立,2020-04-01 02:36:38.997
53397135,辰翔網路科技有限公司,桃園市龜山區中興里民權街40巷7號,0,核准設立,2020-04-01 02:36:38.997
53398704,星倫有限公司,新北市樹林區柑園里寶園街8號,null,廢止,2020-04-01 02:36:38.997
53404641,正展國際事業有限公司,臺中市西屯區工業區一路96之25號1樓,0,核准設立,2020-04-01 02:36:38.997
53405418,聚聯設計工程有限公司,臺南市東區東智里崇德路915號1樓,0,核准設立,2020-04-01 02:36:38.997
53408864,台灣水上水股份有限公司,臺中市中區大墩里臺灣大道一段329號11樓之6,10000000,核准設立,2020-04-01 02:36:38.997
53411988,蓁讚國際股份有限公司,新北市三重區中正北路193巷21弄26號,3000000,核准設立,2020-04-01 02:36:38.997
53412369,華人電通文化傳媒有限公司,新北市五股區五工三路116巷2號(4樓),0,核准設立,2020-04-01 02:36:38.997
53419335,聚福興開發有限公司,臺北市南港區忠孝東路5段811號9樓,0,核准設立,2020-04-01 02:36:38.997
53421085,塔特有限公司,新北市蘆洲區中山一路207號,null,核准設立,2020-04-01 02:36:38.997
53424787,媽媽好國際股份有限公司,新北市中和區中山路3段120之13號3樓,50000000,核准設立,2020-04-01 02:36:38.997
53429869,二口國際策略有限公司,新北市五股區民義路1段79之1號4樓,0,核准設立,2020-04-01 02:36:38.997
53452805,鼎上村有限公司,新北市永和區保生路1號13樓之2,0,核准設立,2020-04-01 02:36:38.997
53464274,晉福國際有限公司,新北市新莊區新北大道7段618號13樓,null,核准設立,2020-04-01 02:36:38.997
53468659,台灣李時珍中藥生技股份有限公司,臺北市大安區復興南路1段352號4樓之3,10000000,核准設立,2020-04-01 02:36:38.997
53470135,詠恆國際實業有限公司,桃園市龜山區文化里復興一路146巷1號5樓,0,核准設立,2020-04-01 02:36:38.997
53470894,合利實業股份有限公司,臺中市東勢區中寧里公園路34號1樓,50000000,核准設立,2020-04-01 02:36:38.997
53471850,隆丞國際股份有限公司,屏東縣潮州鎮三共里四維路585號,1000000,核准設立,2020-04-01 02:36:38.997
53472035,南紡流通事業股份有限公司,臺南市東區東光里中華東路1段366號、398號7樓之1,500000000,核准設立,2020-04-01 02:36:38.997
53478143,橙德有限公司,臺中市南屯區永定里南屯路2段900巷50號5樓之5,null,解散,2020-04-01 02:36:38.997
53478609,迅行科技股份有限公司,臺北市中山區新生北路3段76之1號地下1樓,11290000,核准設立,2020-04-01 02:36:38.997
53485860,中僑國際開發有限公司,高雄市鼓山區中華一路350號3樓之1,0,核准設立,2020-04-01 02:36:38.997
53485881,九聯百貨有限公司,臺中市后里區后里里三豐路四段108號,0,核准設立,2020-04-01 02:36:38.997
53486191,網蒐有限公司,臺中市東區精武路94號3樓之1,0,核准設立,2020-04-01 02:36:38.997
53487516,翰裕實業有限公司,彰化縣鹿港鎮埔崙里安祥街92號,0,核准設立,2020-04-01 02:36:38.997
53489275,祐成租賃有限公司,苗栗縣後龍鎮下灣寶庄118-6號1樓,0,核准設立,2020-04-01 02:36:38.997
53492476,毅起企業有限公司,臺中市南屯區春社里永春南路119號,0,核准設立,2020-04-01 02:36:38.997
53494143,辰星數位有限公司,新北市汐止區大同路3段190號6樓,0,核准設立,2020-04-01 02:36:38.997
53496304,安順發有限公司,臺中市西屯區何成里大容東街168號,0,核准設立,2020-04-01 02:36:38.997
53501720,第三方認證有限公司,臺中市北屯區平順里大連路三段21巷55號1樓,0,核准設立,2020-04-01 02:36:38.997
53502903,集爾國際有限公司,桃園市桃園區國豐五街36號6樓,0,核准設立,2020-04-01 02:36:38.997
53503240,永恆國際租賃有限公司,臺中市大雅區雅環路一段259巷2號1樓,0,核准設立,2020-04-01 02:36:38.997
53504085,華雅應用材料股份有限公司,臺南市新市區中山路208號,28000000,核准設立,2020-04-01 02:36:38.997
53505818,躍龍科技有限公司,彰化縣和美鎮柑井里柑竹路29號1樓,0,核准設立,2020-04-01 02:36:38.997
53509413,翊盛國際有限公司,臺中市西屯區惠來里市政路500號27樓之6,0,核准設立,2020-04-01 02:36:38.997
53514577,耐樂實業有限公司,桃園市楊梅區光華里新興街107巷54號(2樓),0,核准設立,2020-04-01 02:36:38.997
53524765,克雷爾企業有限公司,臺北市大安區羅斯福路3段325號8樓之6,null,核准設立,2020-04-01 02:36:38.997
53526166,支付連國際資訊股份有限公司,臺北市大安區敦化南路2段105號12樓,850000000,核准設立,2020-04-01 02:36:38.997
53529706,鑫寰有限公司,新北市板橋區文化路1段285巷34號(1樓),null,核准設立,2020-04-01 02:36:38.997
53531055,天地圖股份有限公司,臺北市中正區忠孝東路1段76號12樓之1,29000000,核准設立,2020-04-01 02:36:38.997
53532131,鉅峰數位科技有限公司,臺北市大安區通化街38巷10之5號,0,核准設立,2020-04-01 02:36:38.997
53539084,欣光空間藝術有限公司,臺北市中山區松江路26巷36號,0,核准設立,2020-04-01 02:36:38.997
53541743,果物憩席股份有限公司,新北市林口區文化三路1段617巷90號2樓-1,5000000,解散,2020-04-01 02:36:38.997
53541954,三一整合行銷有限公司,臺北市信義區松德路65號11樓之2,0,核准設立,2020-04-01 02:36:38.997
53542308,心邑國際有限公司,臺北市萬華區環河南路3段261號4樓,null,核准設立,2020-04-01 02:36:38.997
53551777,美樂帝國際創藝有限公司,新北市三峽區民生街119之10號,0,核准設立,2020-04-01 02:36:38.997
53554599,億凡國際股份有限公司,臺北市大同區南京西路315號3樓,10100000,核准設立,2020-04-01 02:36:38.997
53554681,京品寰宇有限公司,苗栗縣竹南鎮維新路398號,0,核准設立,2020-04-01 02:36:38.997
53555653,跨界所創意有限公司,臺北市中山區松江路372巷16號1樓,0,解散,2020-04-01 02:36:38.997
53556415,鉌豐行銷股份有限公司,臺中市北屯區祥順路二段503號,3000000,核准設立,2020-04-01 02:36:38.997
53558292,萬洲通國際企業有限公司,臺北市信義區吳興街364巷1號,0,核准設立,2020-04-01 02:36:38.997
53561108,漢尼斯國際拍賣股份有限公司,臺北市士林區通河東街1段167巷37號1樓,1000000,核准設立,2020-04-01 02:36:38.997
53564246,宏璽國際股份有限公司,臺北市文山區福興路62號2樓之6,6000000,廢止,2020-04-01 02:36:38.997
53565603,大悲國際有限公司,新北市三峽區大學路140號7樓,0,核准設立,2020-04-01 02:36:38.997
53567399,台灣咪咕數位股份有限公司,新北市汐止區新台五路1段112號10樓,7040000,核准設立,2020-04-01 02:36:38.997
53572647,欣洲興國際有限公司,高雄市左營區自由四路387號1樓,0,核准設立,2020-04-01 02:36:38.997
53573147,互信生物科技股份有限公司,高雄市鹽埕區河西路118號1樓,5000000,核准設立,2020-04-01 02:36:38.997
53579579,台資投資股份有限公司,高雄市苓雅區英明路122號5樓之3,4500000,核准設立,2020-04-01 02:36:38.997
53588541,益杰股份有限公司,高雄市鳳山區光復路二段262號3樓,28500000,核准設立,2020-04-01 02:36:38.997
53591594,行揚科技有限公司,高雄市新興區和平一路219號6樓之3,0,核准設立,2020-04-01 02:36:38.997
53593116,台灣海洋工程顧問有限公司,高雄市新興區中正三路5號11樓之4,null,核准設立,2020-04-01 02:36:38.997
53594179,雲端識別科技有限公司,高雄市左營區文川路74巷3號5樓,0,核准設立,2020-04-01 02:36:38.997
53601805,數碼天空有限公司,新竹縣竹北市十興里勝利六街52號10樓之5,0,核准設立,2020-04-01 02:36:38.997
53610115,立馥實業有限公司,臺中市南屯區豐樂里文心南五路一段205號1樓,0,核准設立,2020-04-01 02:36:38.997
53614323,候鳥國際有限公司,臺南市永康區永大路三段453號,0,核准設立,2020-04-01 02:36:38.997
53618361,科宇數位股份有限公司,臺中市南屯區大同里向上南路一段167號14樓,6500000,核准設立,2020-04-01 02:36:38.997
53619925,中礦發展股份有限公司,臺中市南屯區大業里大聖街342號,20000000,核准設立,2020-04-01 02:36:38.997
53619994,創意金點科技股份有限公司,新竹市東區復興里自由路69號9樓之1,20000000,核准設立,2020-04-01 02:36:38.997
53620520,呈翔科技股份有限公司,臺南市仁德區一甲里太乙二街52號1樓,5000000,核准設立,2020-04-01 02:36:38.997
53623358,鈦通國際有限公司,新北市中和區景新街467巷20弄122號,0,廢止,2020-04-01 02:36:38.997
53625243,十方大眾投資事業股份有限公司,臺中市南區福順里美村路二段182號,13000000,核准設立,2020-04-01 02:36:38.997
53626658,富毅管理顧問有限公司,臺南市安平區慶平路573號5樓,0,核准設立,2020-04-01 02:36:38.997
53638802,康堤生物科技有限公司,臺中市南區南平路2-19號1樓,null,廢止,2020-04-01 02:36:38.997
53647416,瑪卡龍物網有限公司,臺中市南區城隍里台中路162號5樓,null,解散,2020-04-01 02:36:38.997
53647437,風閣娛樂事業有限公司,臺中市西區後龍里12鄰向上路一段17巷8弄1號,null,核准設立,2020-04-01 02:36:38.997
53654773,英屬維京群島商創勢企管顧問有限公司,臺北市大安區仁愛路4段85號7樓,0,核准登記,2020-04-01 02:36:38.997
53655626,薩摩亞商泰騰恩研究股份有限公司,新竹縣竹北市光明五街336-1號5樓之6,0,核准登記,2020-04-01 02:36:38.997
53666686,薩摩亞商鎰啟發股份有限公司,高雄市鳳山區誠德街111號,0,核准登記,2020-04-01 02:36:38.997
53666898,薩摩亞商雅痞數位多媒體有限公司,新竹市東區新安路5號4樓之1,0,撤回認許,2020-04-01 02:36:38.997
53668410,香港商立捷環球股份有限公司,臺中市新社區中和街5段72-6號,0,核准登記,2020-04-01 02:36:38.997
53672104,新加坡商優達斯國際有限公司,臺北市南港區忠孝東路六段21號13樓之1,0,核准登記,2020-04-01 02:36:38.997
53674659,香港商果翼科技股份有限公司,臺北市中正區襄陽路1號5樓,0,核准登記,2020-04-01 02:36:38.997
53675138,英屬維京群島商英孚諮詢有限公司,臺北市文山區福斯羅路5段192巷13號1樓,0,核准登記,2020-04-01 02:36:38.997
53680060,日澳國際開發資產管理有限公司,臺中市西屯區寧夏東二街14號,0,核准設立,2020-04-01 02:36:38.997
53683741,輝揚科技有限公司,新北市中和區景平路493巷3弄3號2樓,0,核准設立,2020-04-01 02:36:38.997
53684381,恆昌國際事業有限公司,新北市蘆洲區中華街103號6樓,0,核准設立,2020-04-01 02:36:38.997
53685017,華欣多媒體有限公司,臺北市大安區忠孝東路4段148號8樓之5,0,核准設立,2020-04-01 02:36:38.997
53685641,皓新數位科技有限公司,新北市樹林區佳園路3段540號11樓,0,解散,2020-04-01 02:36:38.997
53698131,玖旭企業有限公司,桃園市中壢區文化里長春路146之1號2樓,0,核准設立,2020-04-01 02:36:38.997
53699899,兆宏移動科技有限公司,新北市蘆洲區光華路149號(2樓),0,核准設立,2020-04-01 02:36:38.997
53706420,馬克斯科技有限公司,新北市五股區中興路1段6號2樓之3,0,核准設立,2020-04-01 02:36:38.997
53706809,秉囿國際有限公司,新北市新店區安興路105號4樓之1,0,核准設立,2020-04-01 02:36:38.997
53707477,光點國際健康生活股份有限公司,新北市板橋區文化路2段22之2號(3樓),17700000,核准設立,2020-04-01 02:36:38.997
53708308,藝典藝文有限公司,新北市新店區中央八街110號5樓,0,核准設立,2020-04-01 02:36:38.997
53709453,熊霸國際生技股份有限公司,新北市板橋區縣民大道3段221號,5000000,核准設立，但已命令解散,2020-04-01 02:36:38.997
53709968,鑄雲舖股份有限公司,新北市三重區中央北路90巷21號1樓,5500000,核准設立,2020-04-01 02:36:38.997
53718278,義照實業有限公司,新北市蘆洲區中華街79號2樓,0,核准設立,2020-04-01 02:36:38.997
53719522,愛雪兒有限公司,新北市新店區中正路329巷7弄2號4樓,null,核准設立,2020-04-01 02:36:38.997
53723700,愷德國際有限公司,新北市三重區光復路1段83巷2號8樓,null,核准設立,2020-04-01 02:36:38.997
53727868,升鼎科技股份有限公司,臺北市中正區北平東路30之1號6樓,42000000,核准設立,2020-04-01 02:36:38.997
53728043,寶嘉誠有限公司,新北市新莊區新北大道3段5號3樓之5,0,核准設立,2020-04-01 02:36:38.997
53729177,台灣智慧光網股份有限公司,臺北市內湖區民權東路6段11巷37之1號4樓,2750000000,核准設立,2020-04-01 02:36:38.997
53729486,街口金融科技股份有限公司,臺北市松山區長安東路2段225號7樓,1652000000,核准設立,2020-04-01 02:36:38.997
53729916,貿麒實業有限公司,臺北市松山區南京東路5段251巷24弄20之1號2樓,0,解散,2020-04-01 02:36:38.997
53730759,大中華租賃有限公司,新北市三重區正義南路55號2樓之1,0,核准設立,2020-04-01 02:36:38.997
53732617,鑫囍聯合行銷股份有限公司,臺北市松山區撫遠街386巷11號3樓,10000000,解散,2020-04-01 02:36:38.997
53737417,創意點子數位股份有限公司,臺北市內湖區瑞光路580號2樓,95000000,核准設立,2020-04-01 02:36:38.997
53737612,達富利股份有限公司,臺北市松山區敦化北路170號3樓,300000,核准設立,2020-04-01 02:36:38.997
53739652,群傳媒股份有限公司,臺北市中山區建國北路3段92號2樓,152600000,核准設立,2020-04-01 02:36:38.997
53742973,南易實業有限公司,臺北市信義區和平東路3段207巷12號,0,核准設立,2020-04-01 02:36:38.997
53746788,購意思商貿網路股份有限公司,臺北市中正區中山北路1段2號11樓之11,11000000,核准設立,2020-04-01 02:36:38.997
53750733,海鷹智慧財產有限公司,臺北市大安區復興南路1段237號12樓,0,核准設立,2020-04-01 02:36:38.997
53751064,橋田工程有限公司,新北市新莊區中華路1段100號2樓,0,核准設立,2020-04-01 02:36:38.997
53751368,好悠付有限公司,臺北市大安區信義路4段6號11樓之3,0,核准設立,2020-04-01 02:36:38.997
53753990,優偉思策略開展股份有限公司,新北市汐止區大同路1段380號4樓,10000000,核准設立,2020-04-01 02:36:38.997
53754652,點點點行銷有限公司,臺北市信義區和平東路3段255號7樓,0,核准設立,2020-04-01 02:36:38.997
53757187,量喜福國際有限公司,臺北市大安區仁愛路4段68號4樓之9,0,核准設立,2020-04-01 02:36:38.997
53757898,天成優護系統有限公司,臺北市信義區基隆路1段155號5樓之9,0,解散,2020-04-01 02:36:38.997
53761350,益邦國際有限公司,臺北市中山區復興南路1段36之9號7樓,0,核准設立,2020-04-01 02:36:38.997
53762941,雲準科技股份有限公司,臺北市信義區信義路4段415號8樓之1,10000000,核准設立,2020-04-01 02:36:38.997
53764075,台灣伊日股份有限公司,臺北市南港區八德路4段768巷1弄18號4樓之1,170800000,核准設立,2020-04-01 02:36:38.997
53766263,謝謝你好朋友股份有限公司,新北市板橋區雙十路2段10號7樓,23500000,核准設立,2020-04-01 02:36:38.997
53767235,曲嘉屋股份有限公司,臺北市萬華區康定路82號2樓之3,40000000,核准設立，但已命令解散,2020-04-01 02:36:38.997
53767903,新世界創新股份有限公司,桃園市桃園區民生路52號2樓之3,2000000,核准設立,2020-04-01 02:36:38.997
53772504,可兒飾品有限公司,臺北市中山區復興南路1段44號6樓,0,核准設立,2020-04-01 02:36:38.997
53772862,風行天股份有限公司,臺北市中山區長春路15號8樓,45260000,核准設立,2020-04-01 02:36:38.997
53773341,艾得基客行銷顧問股份有限公司,臺北市大安區敦化南路2段76號16樓,3158000,核准設立,2020-04-01 02:36:38.997
53773813,樂意傳播股份有限公司,新北市新店區民權路108號8樓,90000000,核准設立,2020-04-01 02:36:38.997
53774382,氫水新能源有限公司,臺北市南港區三重路19之13號E棟3樓366室,null,解散,2020-04-01 02:36:38.997
53775988,弼媞國際實業有限公司,臺北市中正區重慶南路1段63號8樓之10,0,核准設立,2020-04-01 02:36:38.997
53777466,全通路零售系統股份有限公司,臺北市南港區八德路4段768巷5號6樓,25500000,核准設立,2020-04-01 02:36:38.997
53780188,有容設計顧問有限公司,臺南市安平區育平里永華路2段819號17樓之2,0,核准設立,2020-04-01 02:36:38.997
53783495,以誠國際事業有限公司,新北市三重區重新路5段609巷20號3樓之10,0,核准設立,2020-04-01 02:36:38.997
53786508,飛越國際設計整合有限公司,高雄市鳳山區文龍東路182號,0,核准設立,2020-04-01 02:36:38.997
53791452,酷碰網資訊有限公司,臺中市烏日區烏日里中山路二段381號2樓,0,核准設立,2020-04-01 02:36:38.997
53793120,以羅欣生技開發股份有限公司,高雄市大寮區民貴街39號2樓,40500000,核准設立,2020-04-01 02:36:38.997
53795318,八罩國際股份有限公司,嘉義市東區太平里博東路151號16樓3,23000000,核准設立,2020-04-01 02:36:38.997
53797266,大風雲起創造有限公司,高雄市小港區廠西路65巷13號,0,核准設立,2020-04-01 02:36:38.997
53801000,綠迷文創科技有限公司,臺北市大安區忠孝東路4段191號10樓之1,null,核准設立,2020-04-01 02:36:38.997
53810649,冠宥資產管理有限公司,臺中市南屯區新生里益豐路四段387號4樓之1,0,核准設立,2020-04-01 02:36:38.997
53812750,安天納有限公司,臺中市北區長青里陝西東五街95號地下一樓,0,核准設立,2020-04-01 02:36:38.997
53817740,有樂堂藝術有限公司,新竹縣竹北市新崙里興隆路1段45號12樓,0,核准設立,2020-04-01 02:36:38.997
53822173,中華迪合租賃有限公司,臺中市西屯區惠來里河南路四段159號3樓,0,核准設立,2020-04-01 02:36:38.997
53823166,展森事業有限公司,桃園市桃園區三元街147號15樓,0,核准設立,2020-04-01 02:36:38.997
53829909,瘋樂購數位行銷股份有限公司,臺中市西屯區市政北二路282號14樓之8,10000000,核准設立,2020-04-01 02:36:38.997
53830151,宏越小客車租賃有限公司,臺中市潭子區大豐路三段186巷10號2樓,0,核准設立,2020-04-01 02:36:38.997
53833208,亞博駿國際貿易有限公司,臺中市南區樹義里復興路一段20號,0,核准設立,2020-04-01 02:36:38.997
53833875,鼎發租賃股份有限公司,臺中市西屯區臺灣大道二段718號3樓,28000000,核准設立,2020-04-01 02:36:38.997
53848336,瞻群商務科技股份有限公司,基隆市七堵區六堵里六堵一街170號1樓,600000,核准設立,2020-04-01 02:36:38.997
53850634,曜庭租賃有限公司,桃園市龜山區大華里文化五路223號,0,核准設立,2020-04-01 02:36:38.997
53850711,綠林開發有限公司,臺北市中山區南京東路2段178號5樓,0,廢止,2020-04-01 02:36:38.997
53853225,金桔新創股份有限公司,新竹縣寶山鄉三峰村嵩翠路80巷27號1樓,3000000,核准設立,2020-04-01 02:36:38.997
53853409,長鋒國際有限公司,臺北市中山區長春路410號8樓之3,0,解散,2020-04-01 02:36:38.997
