統一編號,公司名稱,公司地址,實收資本額,公司狀態,產製日期
42826829,八爪研創國際有限公司,臺北市士林區文林路575號3樓,0,核准設立,2020-04-01 02:36:38.997
42826932,艾爾迪斯有限公司,臺北市中正區羅斯福路3段76號8樓之1,0,核准設立,2020-04-01 02:36:38.997
42827003,愛特美越印菲有限公司,臺北市中山區復興北路48號3樓,0,解散,2020-04-01 02:36:38.997
42827138,樂咖國際有限公司,新北市土城區中央路1段145號(2樓),0,核准設立,2020-04-01 02:36:38.997
42827242,艾瑪股份有限公司,臺北市內湖區民善街76號2樓,6000000,核准設立,2020-04-01 02:36:38.997
42827284,嘉禾商務管理顧問有限公司,臺北市大安區敦化南路2段5號2樓之1,0,核准設立,2020-04-01 02:36:38.997
42827854,愛動資數位股份有限公司,臺北市松山區市民大道4段31號4樓,1800000,核准設立,2020-04-01 02:36:38.997
42827947,環球網購有限公司,臺北市松山區民權東路3段178號8樓,0,解散,2020-04-01 02:36:38.997
42828690,啟盛國際有限公司,臺北市中正區南陽街3號5樓之1,0,核准設立,2020-04-01 02:36:38.997
42828919,如時公關顧問有限公司,臺北市中山區民權東路2段46號8樓之2,0,核准設立,2020-04-01 02:36:38.997
42828930,東化科技股份有限公司,臺北市大安區敦化南路2段99號23樓,5000000,核准設立,2020-04-01 02:36:38.997
42830106,飛嚕咪網路科技股份有限公司,臺北市信義區信義路4段415號10樓之3,500000,解散,2020-04-01 02:36:38.997
42830252,常春藤國際股份有限公司,臺北市信義區信義路5段8號14樓,10000000,解散,2020-04-01 02:36:38.997
42830485,箱民網絡股份有限公司,臺北市中正區辛亥路1段33號2樓,200000,核准設立,2020-04-01 02:36:38.997
42830529,素樸東籬股份有限公司,臺北市大安區復興南路2段13號12樓,10000000,核准設立,2020-04-01 02:36:38.997
42830555,水事紀廣告企劃有限公司,臺北市中山區撫順街16號4樓之2,0,核准設立,2020-04-01 02:36:38.997
42830725,鏈接創新有限公司,臺北市大安區四維路375-2號1樓,0,核准設立,2020-04-01 02:36:38.997
42830746,富儒倫信息科技股份有限公司,臺北市中正區北平東路30之1號4樓,2000000,核准設立,2020-04-01 02:36:38.997
42831132,恆易社群有限公司,臺北市中正區羅斯福路3段100號1樓之12,0,核准設立,2020-04-01 02:36:38.997
42831230,天網防禦股份有限公司,臺北市信義區基隆路2段189號15樓之1,10000000,核准設立,2020-04-01 02:36:38.997
42831301,歐琺創智股份有限公司,臺北市大安區新生南路3段2號10樓,2700000,核准設立,2020-04-01 02:36:38.997
42831421,星毅設計股份有限公司,臺北市松山區健康路341號1樓,4000000,核准設立,2020-04-01 02:36:38.997
42832266,創業幫股份有限公司,臺北市中山區長安東路1段52巷9弄1號,3750000,解散,2020-04-01 02:36:38.997
42832293,一定行大數據股份有限公司,臺北市松山區南京東路5段250巷36弄12號,5000000,核准設立,2020-04-01 02:36:38.997
42832694,亨利科技有限公司,臺北市信義區信義路5段7號37樓,0,解散,2020-04-01 02:36:38.997
42832701,奇米整合行銷有限公司,臺北市信義區東興路45號9樓,0,核准設立,2020-04-01 02:36:38.997
42832765,采得揚商務有限公司,臺北市大同區承德路1段46號3樓,0,核准設立,2020-04-01 02:36:38.997
42832884,天絡系統科技股份有限公司,臺北市大安區羅斯福路2段111號14樓之1,2000000,核准設立,2020-04-01 02:36:38.997
42833510,愛克斯有限公司,臺北市松山區八德路4段656號4樓,0,核准設立,2020-04-01 02:36:38.997
42834026,麥德倫國際有限公司,臺北市大安區忠孝東路4段320號2樓,0,核准設立,2020-04-01 02:36:38.997
42834150,達博愛思國際有限公司,臺北市北投區西安街2段249號5樓,0,核准設立,2020-04-01 02:36:38.997
42834285,瑞保網路科技股份有限公司,臺北市松山區南京東路3段287號4樓之1,71547500,核准設立,2020-04-01 02:36:38.997
42835313,紅線緣有限公司,臺北市中山區農安街20號9樓之8,0,核准設立,2020-04-01 02:36:38.997
42835355,博騰資訊股份有限公司,臺北市大同區鄭州路87號7樓,16000000,核准設立,2020-04-01 02:36:38.997
42835453,偉創電子商務有限公司,臺北市中正區忠孝東路1段76號12樓之1,0,核准設立,2020-04-01 02:36:38.997
42836452,亨達利科技有限公司,臺北市中正區羅斯福路2段70號10樓之10,0,解散,2020-04-01 02:36:38.997
42836468,自由之門有限公司,臺北市士林區後港街147號,0,解散,2020-04-01 02:36:38.997
42836713,數位感動科技股份有限公司,臺北市內湖區成功路3段165號6樓,2000000,核准設立,2020-04-01 02:36:38.997
42837213,勉地股份有限公司,臺北市北投區中央北路4段515巷40號4樓,2000000,核准設立,2020-04-01 02:36:38.997
42837277,億新有限公司,臺北市士林區大北路88號1樓,0,核准設立,2020-04-01 02:36:38.997
42837683,北灣國際事業有限公司,臺北市北投區大度路21號,0,核准設立,2020-04-01 02:36:38.997
42839021,博塔納設計行銷有限公司,臺北市萬華區華西街21巷7號3樓,0,核准設立,2020-04-01 02:36:38.997
42839090,法孚國際股份有限公司,臺北市內湖區瑞湖街88號8樓及9樓,51000000,核准設立,2020-04-01 02:36:38.997
42839232,華庭實業有限公司,臺北市南港區市民大道7段8號13樓之6,0,核准設立,2020-04-01 02:36:38.997
42839438,迦豐企業有限公司,臺北市萬華區中華路2段150巷25號4樓,0,核准設立,2020-04-01 02:36:38.997
42839459,狂人知識產權有限公司,臺北市中山區南京東路2段101號11樓,0,解散,2020-04-01 02:36:38.997
42839681,飛時創意股份有限公司,臺北市大安區敦化南路2段2號4樓之2,10000000,核准設立,2020-04-01 02:36:38.997
42839704,眾基健康科技股份有限公司,臺北市內湖區瑞光路358巷38弄1號5樓,13777300,核准設立,2020-04-01 02:36:38.997
42839872,物聯網通科技股份有限公司,臺北市士林區文林路699號2樓,10000000,核准設立,2020-04-01 02:36:38.997
42840202,小振商務有限公司,臺北市大安區和平東路1段66號9樓,0,核准設立,2020-04-01 02:36:38.997
42840890,旺喜達有限公司,臺北市內湖區行忠路30號7樓,0,核准設立,2020-04-01 02:36:38.997
42841053,享毓科技有限公司,臺北市信義區基隆路2段149-49號11樓之4,0,核准設立,2020-04-01 02:36:38.997
42841125,沛森綠美景有限公司,臺北市中山區建國北路3段75巷1號3樓,0,核准設立,2020-04-01 02:36:38.997
42841531,好時光相信運動有限公司,臺北市中山區龍江路96號4樓,0,核准設立,2020-04-01 02:36:38.997
42841770,源鎰國際租賃有限公司,桃園市蘆竹區濱海里海山路三段142號,0,核准設立,2020-04-01 02:36:38.997
42841960,新研科技股份有限公司,臺北市信義區忠孝東路5段372巷27弄41號5樓,1300000,核准設立,2020-04-01 02:36:38.997
42842497,微媒互動科技股份有限公司,臺北市松山區市民大道6段139號4樓之16,10000000,核准設立,2020-04-01 02:36:38.997
42842617,寰宇智慧資訊股份有限公司,臺北市信義區基隆路1段432號4樓之1,7000000,核准設立,2020-04-01 02:36:38.997
42842665,健康寶科技股份有限公司,臺北市內湖區文德路210巷30弄6號12樓之1,3000000,核准設立,2020-04-01 02:36:38.997
42842882,臺灣好行有限公司,臺北市中正區晉江街112巷2弄12號2樓,0,核准設立,2020-04-01 02:36:38.997
42843236,雲派科技有限公司,臺北市內湖區新湖三路118號4樓,0,核准設立,2020-04-01 02:36:38.997
42843756,教教我國際教育顧問有限公司,臺北市士林區士東路91巷50號,0,核准設立,2020-04-01 02:36:38.997
42845327,俳斐國際有限公司,臺北市大安區忠孝東路4段206之1號4樓,0,核准設立,2020-04-01 02:36:38.997
42845570,中旭國際有限公司,臺北市中正區重慶南路1段77號6樓之2,0,核准設立,2020-04-01 02:36:38.997
42845804,樂之味股份有限公司,臺北市松山區南京東路5段188號8樓之3,5000000,核准設立,2020-04-01 02:36:38.997
42845902,高泊科技股份有限公司,臺北市士林區重慶北路4段248號3樓,2000000,核准設立,2020-04-01 02:36:38.997
42846304,慕易國際有限公司,臺北市中山區民權東路2段46號9樓之1,0,核准設立,2020-04-01 02:36:38.997
42846347,曼馳貿易有限公司,臺北市松山區八德路4段656號4樓,0,核准設立,2020-04-01 02:36:38.997
42846590,新眺創意股份有限公司,臺北市中山區建國北路2段120號15樓,2569700,核准設立,2020-04-01 02:36:38.997
42846661,愛瘦美網路傳媒有限公司,臺北市文山區興隆路2段95巷3號1樓,0,核准設立,2020-04-01 02:36:38.997
42846769,亮光鎷有限公司,臺北市大安區信義路4段380號3樓,0,核准設立,2020-04-01 02:36:38.997
42846803,兆陞網路顧問有限公司,臺北市松山區復興北路181號2樓之1,0,核准設立，但已命令解散,2020-04-01 02:36:38.997
42847090,群體資訊有限公司,臺北市大安區基隆路2段110號11樓,0,核准設立,2020-04-01 02:36:38.997
42847155,英飛凌迪金融科技股份有限公司,臺北市北投區公舘路311之2號,29000000,核准設立,2020-04-01 02:36:38.997
42847227,錡郁國際有限公司,臺北市大同區長安西路289號5樓之6,0,核准設立,2020-04-01 02:36:38.997
42847330,爛草莓整合行銷有限公司,臺北市大安區忠孝東路4段107號11樓之1,0,解散,2020-04-01 02:36:38.997
42847417,方旭國際股份有限公司,新北市永和區寶福路1段77巷1號3樓,20000000,核准設立,2020-04-01 02:36:38.997
42847535,蜂書有限公司,臺北市文山區木柵路2段88號4樓,0,核准設立,2020-04-01 02:36:38.997
42847850,智慧環境科技股份有限公司,臺北市士林區菁山路101巷71弄16號,160000000,核准設立,2020-04-01 02:36:38.997
42847964,山佑實業有限公司,臺北市中山區松江路185號6樓之3,0,核准設立,2020-04-01 02:36:38.997
42848366,映華國際娛樂股份有限公司,臺北市萬華區武昌街2段124之2號9樓之1,1000000,核准設立,2020-04-01 02:36:38.997
42848648,康嶸國際養生有限公司,臺北市中正區林森南路122號1樓,0,核准設立,2020-04-01 02:36:38.997
42848886,另存新檔有限公司,臺北市中山區南京東路2段101號11樓,0,解散,2020-04-01 02:36:38.997
42849301,呈食國際行銷有限公司,新北市中和區中山路2段3巷4-2號,0,核准設立,2020-04-01 02:36:38.997
42849597,煦樸國際開發有限公司,臺北市松山區民族東路689號1樓,0,核准設立,2020-04-01 02:36:38.997
42849800,玖暐資訊有限公司,臺北市中正區重慶南路1段121號6樓之16,0,核准設立,2020-04-01 02:36:38.997
42849885,昂立資訊整合有限公司,臺北市松山區南京東路3段259號10樓,0,核准設立,2020-04-01 02:36:38.997
42850123,同安科技有限公司,臺北市信義區松德路125號10樓之1,0,核准設立,2020-04-01 02:36:38.997
42850138,愛蕊科技有限公司,臺北市大安區復興南路2段327號3樓之3,0,解散,2020-04-01 02:36:38.997
42850290,你好我好企業股份有限公司,臺北市中山區民權東路3段74號17樓,5500000,核准設立,2020-04-01 02:36:38.997
42850334,集界科技股份有限公司,臺北市南港區南港路3段52號9樓,40000000,核准設立,2020-04-01 02:36:38.997
42851755,鎂驊能源科技股份有限公司,臺北市信義區基隆路1段37巷28號1樓,5000000,核准設立,2020-04-01 02:36:38.997
42851930,臺灣金融科技股份有限公司,臺北市信義區基隆路1段432號4樓之1,59100000,核准設立,2020-04-01 02:36:38.997
42852092,看路網股份有限公司,臺北市信義區基隆路1段420號3樓,1400000,解散,2020-04-01 02:36:38.997
42852142,巧科資訊股份有限公司,臺北市中山區松江路226巷12之2號2樓,1000000,核准設立,2020-04-01 02:36:38.997
42852163,智快科技股份有限公司,臺北市大安區忠孝東路4段221號12樓,5000000,核准設立,2020-04-01 02:36:38.997
42852403,澄楷商情資訊有限公司,臺北市中山區基湖路151巷21號5樓之9,0,核准設立,2020-04-01 02:36:38.997
42852451,零一股份有限公司,臺北市士林區中正路115號,5000000,核准設立,2020-04-01 02:36:38.997
42852500,奧創移動科技股份有限公司,臺北市大同區哈密街65號1樓,5100000,核准設立,2020-04-01 02:36:38.997
42852781,眾雲媒體科技有限公司,臺北市信義區松山路482巷32號12樓,0,核准設立,2020-04-01 02:36:38.997
42853281,其雲科技有限公司,臺北市中山區松江路38巷2號8樓之1,0,解散,2020-04-01 02:36:38.997
42853418,輕量數據有限公司,臺北市松山區民生東路5段171號10樓,0,核准設立,2020-04-01 02:36:38.997
42853629,牛日科技有限公司,臺北市中山區天祥路59號7樓之3,0,解散,2020-04-01 02:36:38.997
42853640,督督網有限公司,臺北市中山區南京西路1之1號7樓,null,解散,2020-04-01 02:36:38.997
42853965,小暖健康股份有限公司,臺北市大安區仁愛路4段34號2樓,2000000,核准設立,2020-04-01 02:36:38.997
42854161,黎帝亞錢幣有限公司,臺北市中山區松江路51號7樓之3,0,核准設立,2020-04-01 02:36:38.997
42854177,蹦蛙數位娛樂有限公司,臺北市中正區寧波西街1號2樓,0,核准設立,2020-04-01 02:36:38.997
42854535,璐璐卡有限公司,臺北市大安區忠孝東路4段320號2樓,0,解散,2020-04-01 02:36:38.997
42854937,旅型資訊股份有限公司,臺北市信義區松德路10號6樓,4000000,核准設立,2020-04-01 02:36:38.997
42855020,漢斯整合行銷有限公司,臺北市萬華區梧州街37號8樓之1,0,核准設立,2020-04-01 02:36:38.997
42855181,永信資產開發股份有限公司,臺北市大同區承德路1段35號5樓之2,3000000,核准設立,2020-04-01 02:36:38.997
42855485,史基農生技股份有限公司,臺北市中山區民生西路16號9樓之5,3000000,核准設立,2020-04-01 02:36:38.997
42855963,壹聯網股份有限公司,臺北市南港區三重路19之13號3樓,22350000,解散,2020-04-01 02:36:38.997
42856386,眾奌溝通有限公司,臺北市大安區基隆路2段154號3樓,0,核准設立,2020-04-01 02:36:38.997
42856576,慧誠智醫股份有限公司,臺北市內湖區內湖路1段66號4樓,73140000,核准設立,2020-04-01 02:36:38.997
42856956,三八六系統有限公司,臺北市內湖區瑞湖街88號8樓,0,核准設立,2020-04-01 02:36:38.997
42857060,博聯行銷有限公司,臺北市信義區基隆路2段48號4樓之3,0,核准設立，但已命令解散,2020-04-01 02:36:38.997
42857385,翡凡人國際企業有限公司,臺北市大安區仁愛路4段62號4樓之6,0,解散,2020-04-01 02:36:38.997
42857483,聯華資產管理有限公司,臺北市中正區漢口街1段110號8樓之1,0,解散,2020-04-01 02:36:38.997
42857527,乙谷田國際行銷有限公司,新北市新莊區頭前路111號8樓,0,解散,2020-04-01 02:36:38.997
42857688,雲寶網絡科技有限公司,臺北市信義區信義路5段7號37樓,0,解散,2020-04-01 02:36:38.997
42857890,感知科技股份有限公司,臺北市大安區四維路198巷30弄10號2樓之3,1000000,核准設立,2020-04-01 02:36:38.997
42858130,京睿有限公司,臺北市內湖區瑞光路76巷67號3樓,0,核准設立,2020-04-01 02:36:38.997
42858151,聚智網有限公司,臺北市萬華區環河南路2段218號5樓之1,0,核准設立,2020-04-01 02:36:38.997
42858194,久大數位科技股份有限公司,臺北市大安區復興南路1段243號6樓,5000000,解散,2020-04-01 02:36:38.997
42858737,變型科技股份有限公司,臺北市大安區羅斯福路3段309號,8000000,核准設立,2020-04-01 02:36:38.997
42860071,展隆國際有限公司,臺北市信義區大道路17號1樓,0,核准設立,2020-04-01 02:36:38.997
42860570,容易付有限公司,臺北市大安區忠孝東路3段303號2樓之2,0,核准設立,2020-04-01 02:36:38.997
42860620,樺瓏國際有限公司,新竹市北區湳雅街313巷50號1樓,0,核准設立,2020-04-01 02:36:38.997
42860987,詩軒顧問有限公司,臺北市松山區八德路4段401號2樓,0,核准設立,2020-04-01 02:36:38.997
42861557,鴻鈺國際貿易有限公司,臺北市南港區南港路3段80巷18之2號,0,核准設立,2020-04-01 02:36:38.997
42861584,聯合映像有限公司,臺北市北投區致遠三路101巷9號,0,核准設立,2020-04-01 02:36:38.997
42862140,文本直送股份有限公司,臺北市松山區光復南路1號3樓,9516000,核准設立,2020-04-01 02:36:38.997
42862155,寒泰國際股份有限公司,臺北市大安區敦化南路2段103巷8號1樓,9000000,解散,2020-04-01 02:36:38.997
42862198,台灣汽車修護有限公司,新北市永和區中和路601號(3樓),0,核准設立,2020-04-01 02:36:38.997
42862697,好好投資科技股份有限公司,臺北市中正區南海路1號13樓,47000000,核准設立,2020-04-01 02:36:38.997
42862845,皇贊股份有限公司,臺北市文山區萬芳路60之10號1樓,8100000,核准設立,2020-04-01 02:36:38.997
42862970,樂淘科技有限公司,臺北市中山區建國北路2段33號10樓之3,0,核准設立,2020-04-01 02:36:38.997
42863041,方略數位整合有限公司,臺北市信義區基隆路1段141號2樓,0,解散,2020-04-01 02:36:38.997
42863176,你好世界有限公司,臺北市松山區八德路4段181巷22號1樓,0,核准設立,2020-04-01 02:36:38.997
42863226,宇闊有限公司,新北市永和區安樂路106號(1樓),0,核准設立,2020-04-01 02:36:38.997
42863366,豐耀國際貿易有限公司,新北市三重區環河南路120之1號,0,核准設立,2020-04-01 02:36:38.997
42863751,美克資訊有限公司,臺北市松山區八德路4段306號9樓,0,核准設立,2020-04-01 02:36:38.997
42863942,七法股份有限公司,新北市三重區重新路2段14號7樓,6000000,核准設立,2020-04-01 02:36:38.997
42863963,鉅資科技有限公司,臺北市中山區南京東路2段137號14樓,0,核准設立,2020-04-01 02:36:38.997
42864175,凱研資訊服務有限公司,臺北市南港區忠孝東路6段467號2樓,0,核准設立,2020-04-01 02:36:38.997
42864196,龍源數位娛樂有限公司,臺北市信義區信義路4段456號11樓,0,核准設立,2020-04-01 02:36:38.997
42864983,數位鎏股份有限公司,臺北市中山區民權東路2段42號6樓,10100000,核准設立,2020-04-01 02:36:38.997
42865081,子承國際有限公司,桃園市龜山區文化三路13號（1樓）,0,核准設立,2020-04-01 02:36:38.997
42865097,創富網路科技有限公司,臺北市大同區塔城街39號3樓之2,0,核准設立,2020-04-01 02:36:38.997
42865364,無窮科技股份有限公司,新北市林口區仁愛路2段502號6樓,5565000,核准設立,2020-04-01 02:36:38.997
42865821,具景數位整合有限公司,臺北市信義區松德路65號11樓之2,0,核准設立，但已命令解散,2020-04-01 02:36:38.997
42866188,互聯新創有限公司,臺北市信義區永吉路30巷178弄2號2樓,null,核准設立,2020-04-01 02:36:38.997
42866482,王田數位整合有限公司,臺北市松山區光復北路112號3樓,0,核准設立,2020-04-01 02:36:38.997
42866589,超順餐廳股份有限公司,臺北市大安區新生南路3段104號,12750000,核准設立,2020-04-01 02:36:38.997
42866666,云境碼頭股份有限公司,臺北市大同區南京西路163號2樓之98,500000,解散,2020-04-01 02:36:38.997
42866862,安捷莉娜有限公司,臺北市大同區重慶北路3段377號3樓之6,0,核准設立,2020-04-01 02:36:38.997
42866912,棨揚科技有限公司,臺北市南港區忠孝東路6段467號2樓,0,核准設立,2020-04-01 02:36:38.997
42866976,簡單生活科技股份有限公司,臺北市中山區錦州街46號9樓之1,1000000,解散,2020-04-01 02:36:38.997
42867124,智齡股份有限公司,臺北市大安區大安路1段19巷14號2樓,5700000,核准設立,2020-04-01 02:36:38.997
42867150,瘋點數位有限公司,臺北市內湖區康樂街162巷1號3樓,0,核准設立,2020-04-01 02:36:38.997
42867335,摩將科技股份有限公司,臺北市南港區三重路19之11號4樓,3680000,核准設立,2020-04-01 02:36:38.997
42867855,川潮有限公司,臺北市松山區南京東路4段50號12樓之1,0,核准設立,2020-04-01 02:36:38.997
42867948,金達興業有限公司,新北市中和區建一路103號2樓,0,解散,2020-04-01 02:36:38.997
42868003,維銘有限公司,臺北市北投區公舘路144號4樓,0,核准設立,2020-04-01 02:36:38.997
42868931,台灣旅人箱股份有限公司,臺北市大安區復興南路1段293號2樓之1,500000,核准設立,2020-04-01 02:36:38.997
42869690,台品集國際行銷顧問有限公司,澎湖縣馬公市啟明里仁愛路45號1樓,0,核准設立,2020-04-01 02:36:38.997
42869707,德鋐科技有限公司,臺北市信義區永吉路127巷19號1樓,0,核准設立,2020-04-01 02:36:38.997
42870269,淡江創新育成人力資源股份有限公司,臺北市中山區撫順街35號3樓,800000,核准設立,2020-04-01 02:36:38.997
42870394,熊老大有限公司,臺中市霧峰區北柳里四德路282之21號1樓,0,核准設立,2020-04-01 02:36:38.997
42870768,雷董資產管理顧問有限公司,臺中市西區民生里自由路一段106號2樓之1,0,核准設立,2020-04-01 02:36:38.997
42871078,荃詠股份有限公司,臺中市外埔區水美里水美路92號,2250000,核准設立,2020-04-01 02:36:38.997
42871106,青穀國際事業有限公司,臺中市西區向上路一段109號,0,核准設立,2020-04-01 02:36:38.997
42871112,放學科普教育有限公司,臺中市南屯區豐樂里文心南七路188號1樓,0,核准設立,2020-04-01 02:36:38.997
42871274,巴比倫國際文化有限公司,臺中市西屯區朝富路2號4樓,0,核准設立,2020-04-01 02:36:38.997
42871703,金億達有限公司,花蓮縣花蓮市民孝里中美路301之3號1樓,0,核准設立,2020-04-01 02:36:38.997
42872230,保辰人本有限公司,臺中市南區和平里忠明南路758號10樓,0,解散,2020-04-01 02:36:38.997
42872739,智聯微網科技有限公司,臺中市西屯區市政路402號10樓之2,0,核准設立,2020-04-01 02:36:38.997
42873245,聯合創富生活有限公司,臺中市豐原區南村里水源路283巷50號1樓,0,核准設立,2020-04-01 02:36:38.997
42873300,貿順國際有限公司,臺中市西屯區寧夏路195之8號,null,核准設立,2020-04-01 02:36:38.997
42873738,無次元股份有限公司,臺中市南屯區同心里南屯路2段290號1樓,10000000,核准設立,2020-04-01 02:36:38.997
42874238,鯨采網路科技有限公司,臺中市西屯區惠來里文心路三段13之7號,0,核准設立,2020-04-01 02:36:38.997
42874687,米草科技有限公司,臺中市沙鹿區埔子里屏西路357號2樓,0,核准設立,2020-04-01 02:36:38.997
42874743,宏騰企業有限公司,臺中市東勢區新盛里東關路六段657號1樓,0,核准設立,2020-04-01 02:36:38.997
42874814,底特爾數位有限公司,臺中市北區賴福里太原路二段200號8樓,0,核准設立,2020-04-01 02:36:38.997
42875095,共享經濟電商股份有限公司,臺中市北屯區平安里文心路四段696號16樓之1,15000000,解散,2020-04-01 02:36:38.997
42875460,聯營科技股份有限公司,臺中市北屯區興安路二段466號13樓,1000000,核准設立,2020-04-01 02:36:38.997
42875659,玖夕生物科技有限公司,臺中市大雅區民豐街154巷10號3樓之4,0,核准設立,2020-04-01 02:36:38.997
42875953,曜田原創會社有限公司,臺中市西屯區西安里西苑二街65號1樓,0,核准設立,2020-04-01 02:36:38.997
42876003,品和有限公司,臺中市西屯區何成里文心路二段562之1號3樓之1,0,解散,2020-04-01 02:36:38.997
42876799,騰煌國際貿易有限公司,臺中市西區双龍里模範街24巷1號3樓之3,0,核准設立,2020-04-01 02:36:38.997
42876860,大侑營造有限公司,臺中市烏日區螺潭里溪南路二段169巷46號1樓,0,核准設立,2020-04-01 02:36:38.997
42877214,彩悅數碼有限公司,臺中市北區健行里健行路926號1樓,0,核准設立,2020-04-01 02:36:38.997
42877615,福利點有限公司,臺中市北屯區陳平里中清路二段552巷8弄26號1樓,0,核准設立,2020-04-01 02:36:38.997
42878086,寬耀藝術有限公司,臺中市西區昇平里向上路一段79巷38號,0,核准設立,2020-04-01 02:36:38.997
42878163,逢大文創實業有限公司,臺中市西屯區逢福里逢大路1號,0,核准設立,2020-04-01 02:36:38.997
42878261,威識有限公司,臺中市北區賴村里中清路一段372號4樓,0,解散,2020-04-01 02:36:38.997
42879162,倍領行銷有限公司,臺中市龍井區新東里遊園南路255巷1弄11號1樓,0,解散,2020-04-01 02:36:38.997
42880421,鴻康創意科技開發有限公司,臺中市北屯區北平路四段26之2號,0,解散,2020-04-01 02:36:38.997
42881147,冠永騰國際有限公司,臺中市潭子區潭陽里中山路二段223號,0,核准設立,2020-04-01 02:36:38.997
42881499,甯埡有限公司,臺中市潭子區東寶里雅潭路三段9之16號,null,核准設立,2020-04-01 02:36:38.997
42881511,創億網頁設計有限公司,臺中市南區福平里光輝街74號1樓,null,核准設立,2020-04-01 02:36:38.997
42882096,易起科技有限公司,臺中市太平區立德街91號地下層,null,核准設立,2020-04-01 02:36:38.997
42882336,海淘股份有限公司,臺中市潭子區崇德路四段2號,3500000,解散,2020-04-01 02:36:38.997
42882434,愛玩娛樂股份有限公司,臺中市南區復興路三段350巷4號2樓,2000000,核准設立,2020-04-01 02:36:38.997
42882526,鋮豐實業有限公司,臺中市東區東信里振興路369之21號1樓,0,核准設立,2020-04-01 02:36:38.997
42882624,環碩聚合顧問有限公司,臺中市北屯區崇德一路66號1樓,null,核准設立,2020-04-01 02:36:38.997
42882693,梵星國際有限公司,臺中市西區民龍里臺灣大道二段307號6樓之1,0,核准設立,2020-04-01 02:36:38.997
42883124,天頂科技股份有限公司,臺中市西屯區福安里安和路168號3樓之6,3000000,解散,2020-04-01 02:36:38.997
42884088,日出土地開發有限公司,臺中市西區自由路一段106號2樓之1,0,核准設立,2020-04-01 02:36:38.997
