統一編號,公司名稱,公司地址,實收資本額,公司狀態,產製日期
03221766,法蝶國際開發股份有限公司,臺北市中山區南京東路2段36號7樓,42000000,核准設立,2020-04-01 02:36:38.997
05068507,祥富管理顧問股份有限公司,新北市板橋區中山路1段1號4樓之8,11000000,核准設立,2020-04-01 02:36:38.997
05166423,熙隆有限公司,新北市新店區順安街54巷20號5樓,0,核准設立,2020-04-01 02:36:38.997
05184787,金石堂圖書股份有限公司,臺北市中正區汀州路3段184號1樓之11，12，13，14，15，16，17，18，及192號地下室,355991000,核准設立,2020-04-01 02:36:38.997
05190649,金盈通信電機有限公司,臺北市中正區羅斯福路2段198號2樓之1,0,核准設立,2020-04-01 02:36:38.997
05710326,良綺企業股份有限公司,基隆市中正區中正路30號10樓,7000000,核准設立,2020-04-01 02:36:38.997
07731810,新集興實業股份有限公司,新北市汐止區大同路3段621號6樓之7,29000000,核准設立,2020-04-01 02:36:38.997
07735055,安生紡織有限公司,新北市新莊區新興街45巷1號1樓,0,核准設立,2020-04-01 02:36:38.997
09451856,顯德投資有限公司,新北市林口區竹林路606巷5號,0,核准設立,2020-04-01 02:36:38.997
11456028,南陽實業股份有限公司,臺北市內湖區南京東路6段386號3樓,1411862760,核准設立,2020-04-01 02:36:38.997
11626207,國華欣業股份有限公司,臺北市大安區羅斯福路3段37號15樓,100000000,解散,2020-04-01 02:36:38.997
12130990,慧寶實業有限公司,臺北市中正區中華路1段77號11樓之2,0,核准設立,2020-04-01 02:36:38.997
12135600,統振股份有限公司,臺北市內湖區安美街181號1樓及6樓,896700380,核准設立,2020-04-01 02:36:38.997
12171149,點吾企業有限公司,臺北市中山區吉林路79號3樓之3,0,核准設立,2020-04-01 02:36:38.997
12228213,廉美裝璜有限公司,臺北市松山區興安街170號1樓,0,核准設立,2020-04-01 02:36:38.997
12228473,神腦國際企業股份有限公司,新北市新店區中正路531號2樓,2582526570,核准設立,2020-04-01 02:36:38.997
12363110,勁峯企業有限公司,新北市汐止區南興路51號6樓,0,核准設立,2020-04-01 02:36:38.997
12403534,康和資訊系統股份有限公司,臺北市內湖區瑞光路318號5樓,231133720,核准設立,2020-04-01 02:36:38.997
12409903,優瑩貿易有限公司,臺北市中山區錦州街46號9樓之1,0,核准設立,2020-04-01 02:36:38.997
12461442,鈺翔廣告股份有限公司,臺北市中山區建國北路3段79號7樓,12000000,核准設立,2020-04-01 02:36:38.997
12563980,千佑興業有限公司,新北市八里區龍米路2段88之1號6樓,0,核准設立,2020-04-01 02:36:38.997
12619859,晶璽科技有限公司,嘉義縣太保市舊埤里新埤5之18號,0,解散,2020-04-01 02:36:38.997
12656354,金財通商務科技服務股份有限公司,臺北市松山區南京東路3段261號7樓,135000000,核准設立,2020-04-01 02:36:38.997
12665065,倍利國際科技股份有限公司,臺北市內湖區內湖路1段91巷17號9樓,20000000,核准設立,2020-04-01 02:36:38.997
12668703,高格亞翼資訊股份有限公司,臺北市松山區八德路3段2號9樓之1,8000000,核准設立,2020-04-01 02:36:38.997
12670617,碩盈投資顧問有限公司,臺北市大安區安和路1段83號2樓,0,核准設立,2020-04-01 02:36:38.997
12683417,普陸科技有限公司,臺北市北投區知行路336號4樓之10,0,核准設立,2020-04-01 02:36:38.997
12692416,華將整合行銷有限公司,基隆市中正區砂子里觀海街48號16樓,0,核准設立,2020-04-01 02:36:38.997
12698798,知語有限公司,新北市深坑區深南路198號8樓,0,核准設立,2020-04-01 02:36:38.997
12707656,美林藝術文創股份有限公司,臺中市南屯區三和里干城街328號4樓之1,12800000,核准設立,2020-04-01 02:36:38.997
12716769,獵戶座企業股份有限公司,臺中市北區賴厝里梅川西路三段66號7樓,5000000,核准設立,2020-04-01 02:36:38.997
12746074,靖成企業有限公司,新北市中和區連城路171巷46號,0,核准設立,2020-04-01 02:36:38.997
12751857,華晟開發科技有限公司,臺南市安平區建平十七街157號13樓之2,0,核准設立,2020-04-01 02:36:38.997
12753335,捷達威數位科技股份有限公司,臺北市內湖區瑞湖街111號,160000000,核准設立,2020-04-01 02:36:38.997
12782731,忠義堂國際有限公司,雲林縣斗南鎮西岐里中興路170巷284號1樓,null,核准設立,2020-04-01 02:36:38.997
12798190,伊利特企業管理顧問股份有限公司,臺北市大同區太原路97巷18號,6500000,核准設立,2020-04-01 02:36:38.997
12812799,如宏企業有限公司,新竹市北區舊社里湳雅街313巷27弄19號一樓,0,核准設立,2020-04-01 02:36:38.997
12814558,准詳有限公司,臺北市中正區黎明里館前路20號5樓,0,核准設立,2020-04-01 02:36:38.997
12819081,金妍泰科技股份有限公司,臺中市西屯區潮洋里市政北二路282號14樓之11,10320000,核准設立,2020-04-01 02:36:38.997
12843688,現代鐘錶有限公司,嘉義市自治里中山路559號,null,核准設立,2020-04-01 02:36:38.997
12843890,翊霖科技股份有限公司,臺南市安定區新吉里新吉56之24號,20000000,核准設立,2020-04-01 02:36:38.997
12846637,台極科技有限公司,臺南市安南區佃西里佃西路7號1樓,0,核准設立,2020-04-01 02:36:38.997
12849711,韋冠科技有限公司,新北市三峽區中正路1段164號3樓,null,核准設立,2020-04-01 02:36:38.997
12850478,享弘實業有限公司,桃園市中壢區松仁路2號4樓之1,0,核准設立,2020-04-01 02:36:38.997
12856085,存康生技股份有限公司,臺北市松山區南京東路3段259號10樓,8000000,核准設立,2020-04-01 02:36:38.997
12861587,統一國際企業股份有限公司,高雄市大社區學府路225巷2號3樓,107000000,核准設立,2020-04-01 02:36:38.997
12871142,集速互動股份有限公司,新北市三重區環河北路1段350號13樓,4500000,核准設立,2020-04-01 02:36:38.997
12875858,數瑪有限公司,臺北市中山區長安東路2段181號3樓之2,0,核准設立,2020-04-01 02:36:38.997
12876738,容生股份有限公司,新北市中和區中正路872號5樓之1,5000000,核准設立,2020-04-01 02:36:38.997
12890817,瑞森國際興業有限公司,新北市三峽區中正路1段292巷18號1樓,null,核准設立,2020-04-01 02:36:38.997
12900646,澔學學習股份有限公司,新竹市自由路111號8樓之1,24851390,核准設立,2020-04-01 02:36:38.997
12906923,民雄國際有限公司,嘉義縣民雄鄉金興村忠義街196號1樓,0,核准設立,2020-04-01 02:36:38.997
12910200,禹杰企業有限公司,高雄市路竹區文北里延平路756巷34號,0,核准設立,2020-04-01 02:36:38.997
12912875,生洋網路股份有限公司,臺北市松山區復興北路101號11樓、11樓之1之11,10000000,核准設立,2020-04-01 02:36:38.997
12931021,聯亞全球股份有限公司,臺北市松山區八德路2段374號11樓之8,10000000,核准設立,2020-04-01 02:36:38.997
12945123,淳興能量科技有限公司,新北市新莊區中央路293號5樓,0,核准設立,2020-04-01 02:36:38.997
12956129,子辰國際科技股份有限公司,臺北市松山區八德路2段350號9樓,63500000,核准設立,2020-04-01 02:36:38.997
12972628,鼎耀整合顧問股份有限公司,臺中市北屯區祥順路二段503號,10000000,核准設立,2020-04-01 02:36:38.997
12973318,全球整合國際網路有限公司,新北市板橋區漢生東路173號2樓之1,0,核准設立,2020-04-01 02:36:38.997
12979988,惟真國際有限公司,新北市林口區竹林路3之10號,0,核准設立,2020-04-01 02:36:38.997
12985089,承瓏工程有限公司,新北市永和區秀朗路1段108巷2號1樓,0,核准設立,2020-04-01 02:36:38.997
12992053,鑫國照明有限公司,臺中市豐原區翁子里富陽路59號1樓,0,核准設立,2020-04-01 02:36:38.997
13003331,松懋國際開發有限公司,新北市五股區五福路6巷37號,null,核准設立,2020-04-01 02:36:38.997
13014695,宅博士居家修繕有限公司,臺中市烏日區烏日里中山路二段381號2樓,0,核准設立,2020-04-01 02:36:38.997
13028396,宏瑋實業有限公司,桃園市八德區茄苳里永豐路206號,null,解散,2020-04-01 02:36:38.997
13031224,萬事達通運有限公司,臺中市北屯區和平里環中東路二段103號1樓,0,核准設立,2020-04-01 02:36:38.997
13039154,仲霖能源股份有限公司,桃園市龍潭區健行路345巷59弄34號2樓,10000000,核准設立,2020-04-01 02:36:38.997
13051071,我家的開心農場有限公司,桃園市龍潭區中興路317巷60弄18號,0,核准設立,2020-04-01 02:36:38.997
13057878,穎川科技有限公司,新北市新莊區中華路1段8號9樓,0,核准設立,2020-04-01 02:36:38.997
13073336,後山園企業有限公司,臺東縣臺東市南榮里志航路一段477巷71號1樓,0,核准設立,2020-04-01 02:36:38.997
13091427,棨焌有限公司,臺北市松山區南京東路5段40號12樓之12,0,核准設立,2020-04-01 02:36:38.997
13098435,創意棧廣告有限公司,臺北市中正區信義路2段251號7樓之1,0,核准設立,2020-04-01 02:36:38.997
13113127,采杰公關顧問股份有限公司,臺北市中正區八德路1段5號4樓之1,21000000,核准設立,2020-04-01 02:36:38.997
13117186,海帝國際資訊股份有限公司,基隆市中山區德安路116巷68號,20000000,解散,2020-04-01 02:36:38.997
13119419,麒銘國際股份有限公司,桃園市桃園區中寧里大興西路二段104-1號,10000000,解散,2020-04-01 02:36:38.997
13122081,風華世代有限公司,臺北市中山區錦州街159號3樓之2,0,核准設立,2020-04-01 02:36:38.997
13125897,誠和理國際顧問有限公司,臺北市中山區復興北路2號5樓之3,null,核准設立,2020-04-01 02:36:38.997
13127749,銧明科技有限公司,臺北市中山區建國北路1段29號3樓,null,核准設立,2020-04-01 02:36:38.997
13131413,統一客樂得服務股份有限公司,臺北市松山區東興路8號8樓,15000000,核准設立,2020-04-01 02:36:38.997
13133290,浩銅汽車有限公司,臺北市內湖區新明路122之1號1樓,null,核准設立,2020-04-01 02:36:38.997
13135537,博進國際有限公司,臺北市中山區新生北路3段48號9樓之1,null,核准設立,2020-04-01 02:36:38.997
13155239,國齡企業有限公司,高雄市苓雅區四維四路3號10樓之1,null,核准設立,2020-04-01 02:36:38.997
13161838,巨蛋藝術飲食文化股份有限公司,高雄市前金區永恆街18號地下一層,1000000,核准設立,2020-04-01 02:36:38.997
13163478,宏拓環球集運有限公司,高雄市苓雅區四維四路199號3樓,0,核准設立,2020-04-01 02:36:38.997
13168396,銘陽美學國際有限公司,高雄市三民區莊敬路135號,0,核准設立,2020-04-01 02:36:38.997
13173829,百里路順股份有限公司,臺北市中山區龍江路457巷2號1樓,10000000,核准設立,2020-04-01 02:36:38.997
13174658,世親實業有限公司,高雄市鼓山區裕豐街143號5樓,0,核准設立,2020-04-01 02:36:38.997
16027151,環球富聯股份有限公司,臺中市北區錦祥里4鄰北屯路18號15樓之4,122500000,核准設立,2020-04-01 02:36:38.997
16055536,捷洲資訊股份有限公司,新北市汐止區新台五路1段96號3樓,63000000,核准設立,2020-04-01 02:36:38.997
16062369,惠中電腦資訊有限公司,彰化縣和美鎮和北里倡和街74號1樓,null,核准設立,2020-04-01 02:36:38.997
16068618,棕櫚泉實業股份有限公司,新北市土城區中央路2段191號8樓之3,21000000,核准設立,2020-04-01 02:36:38.997
16084477,聯華電信股份有限公司,臺北市內湖區舊宗路2段105號4樓,405000000,核准設立,2020-04-01 02:36:38.997
16097233,統一東京股份有限公司,臺北市松山區東興路8號12樓,588000000,核准設立,2020-04-01 02:36:38.997
16110427,普星生物科技有限公司,高雄市燕巢區安林三街32號2樓,0,核准設立,2020-04-01 02:36:38.997
16114090,炳昌企業有限公司,高雄市三民區大昌二路462巷44弄12號1樓,0,核准設立,2020-04-01 02:36:38.997
16125322,松承實業有限公司,高雄市楠梓區後昌路876巷2弄109號6樓,0,核准設立,2020-04-01 02:36:38.997
16128643,浦羅企業有限公司,高雄市三民區澄和路115號1樓,0,核准設立,2020-04-01 02:36:38.997
16151427,統一資訊股份有限公司,臺北市內湖區陽光街246號6樓,299005500,核准設立,2020-04-01 02:36:38.997
16164859,愛不釋手有限公司,臺北市大安區延吉街159之4號,null,核准設立,2020-04-01 02:36:38.997
16170016,領安國際有限公司,臺北市北投區懷德街15號,0,核准設立,2020-04-01 02:36:38.997
16195403,柏昇汽車有限公司,臺中市西屯區福安里福科路295號1樓,0,核准設立,2020-04-01 02:36:38.997
16203276,順益昌商業有限公司,桃園市八德區永豐路332號,null,核准設立,2020-04-01 02:36:38.997
16226200,百惠資訊事業有限公司,高雄市旗山區鼓山里延平一路491之1號1樓,0,核准設立,2020-04-01 02:36:38.997
16233194,暉信企業有限公司,彰化縣埤頭鄉和豐村斗苑東路178巷10號,0,核准設立,2020-04-01 02:36:38.997
16264386,有幾園生物科技股份有限公司,臺中市梧棲區港埠路一段537號,113800000,核准設立,2020-04-01 02:36:38.997
16292398,高速線電信股份有限公司,新北市中和區建八路16號7樓之1,5000000,廢止,2020-04-01 02:36:38.997
16294451,文佳科技股份有限公司,新竹市東區金山里金山二十五街90號1樓,175042430,核准設立,2020-04-01 02:36:38.997
16297773,蜜威國際有限公司,臺北市大安區麗水街26之2號地下1層,null,核准設立,2020-04-01 02:36:38.997
16312789,犇亞商務股份有限公司,臺北市松山區復興北路99號14樓,110000000,核准設立,2020-04-01 02:36:38.997
16313302,網際威信股份有限公司,臺北市內湖區港墘路200號7樓,172000000,核准設立,2020-04-01 02:36:38.997
16319452,美福倉儲股份有限公司,桃園市蘆竹區長安路2段109號,1300000000,核准設立,2020-04-01 02:36:38.997
16345058,正慶小客車租賃有限公司,新竹市民富里經國路2段324號2樓,0,核准設立,2020-04-01 02:36:38.997
16363766,惠特影科技有限公司,臺北市萬華區興義街46號1樓,0,核准設立,2020-04-01 02:36:38.997
16374692,百創生醫有限公司,新北市蘆洲區信義路39號(1樓),null,核准設立,2020-04-01 02:36:38.997
16376782,文偉股份有限公司,臺北市內湖區金湖路347巷62號,150000000,核准設立,2020-04-01 02:36:38.997
16379508,馬克汀有限公司,新北市三重區仁義街101巷12之1號,0,核准設立,2020-04-01 02:36:38.997
16401895,唐華文化有限公司,嘉義市西區美源里興業西路61號,0,核准設立,2020-04-01 02:36:38.997
16454506,金恆通科技股份有限公司,高雄市新興區民權一路251號13樓之6,51020000,核准設立,2020-04-01 02:36:38.997
16465074,立康興業有限公司,高雄市三民區大昌一路281號,0,核准設立,2020-04-01 02:36:38.997
16480981,隆安醫院管理顧問有限公司,高雄市前鎮區佛公路102號1樓,0,核准設立,2020-04-01 02:36:38.997
16490550,利洛國際有限公司,臺中市南屯區同心里文心路一段212號11樓之3,0,核准設立,2020-04-01 02:36:38.997
16499010,阡翊企業有限公司,新北市蘆洲區民族路181號5樓,null,核准設立,2020-04-01 02:36:38.997
16501732,貝克創意開發股份有限公司,臺中市西屯區潮洋里市政北路二段238號25樓之1,10000000,解散,2020-04-01 02:36:38.997
16502063,緯菱國際有限公司,宜蘭縣員山鄉湖西村2鄰二湖路37號,0,核准設立,2020-04-01 02:36:38.997
16506808,瑞仙綠能產業科技有限公司,桃園市中壢區中山東路三段393號1樓,0,核准設立,2020-04-01 02:36:38.997
16521651,鼎泰國際商務有限公司,臺中市西區公益里華美街276號1樓,0,核准設立,2020-04-01 02:36:38.997
16522259,捷來行銷顧問有限公司,臺南市中西區郡王里大埔街63號,null,核准設立,2020-04-01 02:36:38.997
16539527,黛宇數位科技股份有限公司,臺中市北屯區后庄里后庄三街212巷22號1樓,10000000,核准設立,2020-04-01 02:36:38.997
16563292,名恩資訊有限公司,桃園市中壢區振興里龍岡路三段212號1樓,0,核准設立,2020-04-01 02:36:38.997
16581854,瑋致營造工程科技有限公司,臺北市南港區忠孝東路5段815號5樓之2,0,核准設立,2020-04-01 02:36:38.997
16582875,仁皇實業有限公司,臺北市南港區福德街309巷36號1樓,0,核准設立,2020-04-01 02:36:38.997
16586605,瑞登家居生活百貨有限公司,臺北市大同區延平北路2段240之1號,0,核准設立,2020-04-01 02:36:38.997
16590299,偉康科技股份有限公司,臺北市松山區南京東路5段89號9樓,50000000,核准設立,2020-04-01 02:36:38.997
16606102,網路家庭國際資訊股份有限公司,臺北市大安區敦化南路2段105號12樓,1171594460,核准設立,2020-04-01 02:36:38.997
16612218,美新金融科技服務有限公司,臺北市內湖區新湖一路157號1樓,0,核准設立,2020-04-01 02:36:38.997
16622476,鼎泰聖企業有限公司,新北市永和區永元路17巷7弄2號,null,解散,2020-04-01 02:36:38.997
16628838,超越文化出版事業股份有限公司,臺北市萬華區長沙街2段128號1樓,20000000,核准設立,2020-04-01 02:36:38.997
16646287,台灣長誠控股有限公司,新北市中和區中和路358號8樓之1,0,核准設立,2020-04-01 02:36:38.997
16653287,中陽物流股份有限公司,臺中市西區大隆路20號14樓之1,20000000,核准設立,2020-04-01 02:36:38.997
16676444,彩鎮企業有限公司,臺中市梧棲區文華街28巷28號,0,核准設立,2020-04-01 02:36:38.997
16679343,坤威電訊實業有限公司,臺南市安南區安中路二段115巷1號,0,核准設立,2020-04-01 02:36:38.997
16687625,泰陽道安科技股份有限公司,臺中市西屯區臺灣大道三段681號24樓之1,10000000,核准設立,2020-04-01 02:36:38.997
16720434,誠廣企管顧問有限公司,嘉義市東區吳鳳南路25巷5號,null,核准設立,2020-04-01 02:36:38.997
16740494,全聯實業股份有限公司,臺北市中山區敬業四路33號8樓,3000000000,核准設立,2020-04-01 02:36:38.997
16751560,均輝企業股份有限公司,新北市三重區新北大道2段27號,28000000,核准設立,2020-04-01 02:36:38.997
16756164,微信息股份有限公司,臺中市中區繼光里公園路2-6-36號,13500000,核准設立,2020-04-01 02:36:38.997
16791985,碧雲山生物科技股份有限公司,新北市板橋區南雅東路8號9樓之32,7500000,核准設立,2020-04-01 02:36:38.997
16797854,津田國際有限公司,臺北市北投區文林北路80巷37號,0,核准設立,2020-04-01 02:36:38.997
16855832,立軒營造工程有限公司,臺中市新社區中和里龍安30號1樓,0,核准設立,2020-04-01 02:36:38.997
16859443,僖千企業有限公司,新北市三重區秀江街89號,null,核准設立,2020-04-01 02:36:38.997
16861784,華苓科技股份有限公司,新竹市埔頂里公道五路2段120號12樓之6,109750000,核准設立,2020-04-01 02:36:38.997
16873091,俊丞工程有限公司,新北市永和區永貞路411號,0,核准設立,2020-04-01 02:36:38.997
16893884,鐳達實業有限公司,臺南市中西區臨安路一段261號2樓,0,核准設立,2020-04-01 02:36:38.997
16897024,森程企業有限公司,苗栗縣苗栗市北苗里蕉嶺街37-9號,0,核准設立,2020-04-01 02:36:38.997
16950293,聯鼎國際商務有限公司,新北市新店區中正路154巷9號4樓,0,核准設立,2020-04-01 02:36:38.997
16968723,富玫嘉國際股份有限公司,臺中市西區公館里三民西路105號1樓,10000000,核准設立,2020-04-01 02:36:38.997
16977440,星際租賃有限公司,臺中市東區旱溪西路一段221號1、2樓,0,核准設立,2020-04-01 02:36:38.997
16980578,追風企業股份有限公司,新北市新莊區新莊路75號,28000000,核准設立,2020-04-01 02:36:38.997
16987931,網雲數位有限公司,臺中市西屯區鵬程里逢大路57號17樓之1,null,核准設立,2020-04-01 02:36:38.997
16990963,融薪生命管理股份有限公司,臺中市西屯區黎明路三段282號2樓,15000000,核准設立,2020-04-01 02:36:38.997
16991631,北展有限公司,新北市三重區三和路4段167巷27之3號,null,核准設立,2020-04-01 02:36:38.997
16993568,沅豐工程有限公司,基隆市安樂區鶯歌里12鄰麥金路82號14樓之1,0,核准設立,2020-04-01 02:36:38.997
16998212,全茂智慧軟體有限公司,桃園市平鎮區廣德街90號6樓之1,0,核准設立,2020-04-01 02:36:38.997
19097709,歐亞書局有限公司,新北市新店區北新路1段12號16樓,0,核准設立,2020-04-01 02:36:38.997
20841706,凱瑞小客車租賃有限公司,臺南市北區仁愛里勝利路190巷41號2樓,0,核准設立,2020-04-01 02:36:38.997
20887370,名象品牌形象策略股份有限公司,臺北市信義區忠孝東路4段512號5樓之2,29000000,核准設立,2020-04-01 02:36:38.997
20889953,旭華航空貨運承攬有限公司,臺北市中山區民權東路3段75巷11號,null,核准設立,2020-04-01 02:36:38.997
20909493,中強電子股份有限公司,新北市新店區寶橋路235巷136號(1樓),119203160,核准設立,2020-04-01 02:36:38.997
21239021,達達國際企業股份有限公司,新北市汐止區大同路3段222號6樓,300000000,核准設立,2020-04-01 02:36:38.997
21251973,家毅數位科技有限公司,新北市汐止區力行街59巷9弄2號(1樓),0,核准設立,2020-04-01 02:36:38.997
22171338,友俐企業有限公司,臺北市信義區莊敬路281號1樓,0,核准設立,2020-04-01 02:36:38.997
22199357,台灣德樂士股份有限公司,臺北市中山區大直街104號2樓,5000000,核准設立,2020-04-01 02:36:38.997
22238838,昇昕企業股份有限公司,彰化縣秀水鄉莊雅村中山路133巷20弄4號,25000000,核准設立,2020-04-01 02:36:38.997
22278774,又欣有限公司,新北市中和區莒光路63號4樓,0,核准設立,2020-04-01 02:36:38.997
22292234,鎧興有限公司,新北市新莊區自立街79巷22號1樓,0,核准設立,2020-04-01 02:36:38.997
22336063,騰邁股份有限公司,臺北市信義區基隆路2段189號21樓之3,22000000,核准設立,2020-04-01 02:36:38.997
22347759,宇庭國際文創有限公司,臺北市文山區羅斯福路5段89號3樓,null,核准設立,2020-04-01 02:36:38.997
22413878,兆奇企業有限公司,新北市中和區中正路637巷46號1樓,0,核准設立,2020-04-01 02:36:38.997
22449469,銓漢實業有限公司,新北市新莊區中正路八五三之五號四樓,0,核准設立,2020-04-01 02:36:38.997
22456427,東森得易購股份有限公司,新北市中和區景平路258號地下1樓~4樓及266號地下1樓~1樓,1019163600,核准設立,2020-04-01 02:36:38.997
22470856,華泰電信工程股份有限公司,臺北市中正區杭州南路2段98之1號2樓,10000000,核准設立,2020-04-01 02:36:38.997
22536858,得力品牌顧問有限公司,高雄市鹽埕區教仁里五福四路280號1樓,0,核准設立,2020-04-01 02:36:38.997
22547709,統信企業股份有限公司,高雄市鹽埕區府北路25號12樓之19,2000000,核准設立,2020-04-01 02:36:38.997
22550204,百匯租賃有限公司,臺南市南區大同路二段572號,0,核准設立,2020-04-01 02:36:38.997
22555003,統一超商股份有限公司,臺北市松山區東興路8號8樓,10396222550,核准設立,2020-04-01 02:36:38.997
22559134,開泰機械股份有限公司,桃園市大園區南港里長發一路240號,6100000,核准設立,2020-04-01 02:36:38.997
22565797,關山汽車股份有限公司,臺東縣關山鎮順興路18-6號,25000000,核准設立,2020-04-01 02:36:38.997
22574016,天美小客車租賃股份有限公司,桃園市平鎮區延平路三段428巷44號1樓,5000000,核准設立,2020-04-01 02:36:38.997
22589762,宗佳國際貿易股份有限公司,臺北市中山區新生北路2段28巷5號8樓之3,5000000,核准設立,2020-04-01 02:36:38.997
22597453,秉儒設計開發有限公司,桃園市中壢區仁美里仁慈路42號,0,核准設立,2020-04-01 02:36:38.997
22662550,家福股份有限公司,臺北市南港區南港路2段20巷5號地下1樓,7444823000,核准設立,2020-04-01 02:36:38.997
22674922,民匠實業有限公司,新北市板橋區大觀路2段169巷21號5樓,0,核准設立,2020-04-01 02:36:38.997
22680044,宏翰事業有限公司,新北市板橋區三民路2段37號23樓之1,0,核准設立,2020-04-01 02:36:38.997
22720165,沛康有限公司,臺北市松山區八德路2段374號9樓之7,0,核准設立,2020-04-01 02:36:38.997
22729308,千大國際企業股份有限公司,新北市新店區五峰路63巷10號(1樓),8000000,核准設立,2020-04-01 02:36:38.997
22740850,佳威傳播事業有限公司,臺北市松山區南京東路5段286巷2號4樓之1,0,核准設立,2020-04-01 02:36:38.997
22770544,緣豆兒食品有限公司,新北市淡水區學府路28號5樓,0,核准設立,2020-04-01 02:36:38.997
22853565,來來超商股份有限公司,臺北市信義區松德路131號地下1樓,1050000000,核准設立,2020-04-01 02:36:38.997
22858750,日僑文化事業股份有限公司,臺北市中山區建國北路1段90號10樓之2,30000000,核准設立,2020-04-01 02:36:38.997
22956274,華磁票券印刷股份有限公司,新北市土城區中央路1段365巷7號2樓,116380000,核准設立,2020-04-01 02:36:38.997
22960208,利通小客車租賃有限公司,新竹市香山區香北路45號1樓,0,核准設立,2020-04-01 02:36:38.997
22964210,全島鴻租賃有限公司,基隆市安樂區基金一路208巷98之2號,0,核准設立,2020-04-01 02:36:38.997
23013528,艾青有限公司,臺北市中山區龍江路336號4樓,0,核准設立,2020-04-01 02:36:38.997
23058518,欣技資訊股份有限公司,臺北市大安區敦化南路2段333號12樓,684891200,核准設立,2020-04-01 02:36:38.997
23060248,全家便利商店股份有限公司,臺北市中山區中山北路2段61號7樓,2232200000,核准設立,2020-04-01 02:36:38.997
23134543,捷元股份有限公司,臺北市內湖區瑞光路66巷36號,795694500,核准設立,2020-04-01 02:36:38.997
