統一編號,公司名稱,公司地址,實收資本額,公司狀態,產製日期
64961475,亞辰國際有限公司,臺南市仁德區一甲里太乙二街52號一樓,0,核准設立,2020-04-01 02:36:38.997
64967082,崇靖智富有限公司,臺南市東區林森路一段138號1樓,0,核准設立,2020-04-01 02:36:38.997
64969048,大心國際企業有限公司,臺南市東區小東里光明街213號3樓,0,核准設立,2020-04-01 02:36:38.997
64970137,寰建企業有限公司,臺南市學甲區明宜里濟生路228號2樓,0,核准設立,2020-04-01 02:36:38.997
64971136,上傑國際有限公司,臺南市永康區甲頂里小北路56號2樓,0,核准設立,2020-04-01 02:36:38.997
64971184,陸旭物產營運有限公司,臺南市東區崇成里崇道路94號7樓之2,0,核准設立,2020-04-01 02:36:38.997
64971543,永凱發有限公司,臺南市東區德光里崇學路165號7樓,0,解散,2020-04-01 02:36:38.997
64972022,星傑科技有限公司,臺南市永康區大橋里大橋一街247巷54弄8號,0,核准設立,2020-04-01 02:36:38.997
64973140,天璧企業有限公司,臺南市安南區南里安昌街174巷180號一樓,0,核准設立,2020-04-01 02:36:38.997
64975230,金將賀有限公司,臺南市永康區大橋二街24號7樓之1,0,核准設立,2020-04-01 02:36:38.997
64976110,萬點科技股份有限公司,臺南市新營區大宏里民治路29巷40號1樓,1400000,解散,2020-04-01 02:36:38.997
64982128,實慕斯行銷有限公司,臺南市新市區港墘里中山路78巷25-1號一樓,0,核准設立,2020-04-01 02:36:38.997
64984792,益登系統有限公司,臺南市東區東門路三段31號6樓,0,核准設立,2020-04-01 02:36:38.997
64986715,大熒企業有限公司,臺南市永康區中華路425號4樓之17,0,核准設立,2020-04-01 02:36:38.997
64987138,德億貿易有限公司,臺南市永康區中興里中華路200-5號5樓,0,核准設立,2020-04-01 02:36:38.997
64993379,燦美樂購有限公司,臺南市東區崇學路165號7樓,0,核准設立,2020-04-01 02:36:38.997
64993595,煒賢國際有限公司,臺南市安平區育平路68號13樓之1,0,解散,2020-04-01 02:36:38.997
64999676,翔允數位生活科技股份有限公司,高雄市三民區鼎山街566之7號5樓,1000000,核准設立,2020-04-01 02:36:38.997
64999726,信達數位有限公司,臺南市永康區復興里興國街176巷11號,0,核准設立,2020-04-01 02:36:38.997
65000019,格高企業有限公司,臺南市南區美南街142號1樓,0,核准設立,2020-04-01 02:36:38.997
65010282,釧利國際貿易有限公司,臺南市新營區新東里東興路97號1樓,0,核准設立,2020-04-01 02:36:38.997
65012177,勝通國際科技貿易有限公司,高雄市左營區大中二路428號4樓之1,0,核准設立,2020-04-01 02:36:38.997
65020872,家呈科技股份有限公司,臺南市永康區中興里022鄰中華路198-3號5樓,20000,廢止,2020-04-01 02:36:38.997
65027002,玩美緻一有限公司,臺南市東區大福里中華東路三段626號7樓,0,解散,2020-04-01 02:36:38.997
65058193,數位經濟國際股份有限公司,臺南市永康區中華里中華路12號18樓之4,1012000,核准設立,2020-04-01 02:36:38.997
65058222,耕富管理顧問有限公司,臺南市永康區五王里中山東路142號7樓之6,0,核准設立,2020-04-01 02:36:38.997
65188668,勝利興科技有限公司,新北市林口區民有街22號4樓之1,0,核准設立,2020-04-01 02:36:38.997
65189006,易開科技股份有限公司,新北市板橋區民生路1段33號7樓之2,17000000,核准設立,2020-04-01 02:36:38.997
65190313,御宅互動科技顧問有限公司,新北市新店區新和街87號6樓,0,解散,2020-04-01 02:36:38.997
65222906,利穎科技股份有限公司,新北市中和區中正路766號6樓,1000000,核准設立,2020-04-01 02:36:38.997
65268901,富翔整合行銷有限公司,新北市汐止區新台五路1段129號2樓,0,解散,2020-04-01 02:36:38.997
65279409,東聯互動股份有限公司,新北市土城區中央路4段51號7樓之1,107050000,核准設立,2020-04-01 02:36:38.997
65279652,運匠國際事業有限公司,新北市汐止區新台五路1段97號26樓之8,0,核准設立,2020-04-01 02:36:38.997
65282164,恩智區塊鏈科技有限公司,新北市新店區北新路3段213號10樓,0,核准設立,2020-04-01 02:36:38.997
65355709,新禾國際投資有限公司,新北市板橋區自由路51巷24弄3號,0,核准設立,2020-04-01 02:36:38.997
65405124,三桶金國際企業有限公司,桃園市八德區福興里廣興三路48號(4樓),0,核准設立,2020-04-01 02:36:38.997
65406876,泰佃整合行銷有限公司,新北市板橋區館前東路29之1號,0,廢止,2020-04-01 02:36:38.997
65407381,金品軒鍊金廠股份有限公司,新北市汐止區新台五路1段99號20樓之1,84473520,核准設立,2020-04-01 02:36:38.997
65424500,永亮社交電商股份有限公司,新北市中和區景平路258號(1樓),5000000,核准設立,2020-04-01 02:36:38.997
65443400,樂傑提斯有限公司,新北市三重區自強路4段3巷18號,0,核准設立,2020-04-01 02:36:38.997
65449404,青洋國際實業有限公司,新北市瑞芳區頂坪路瑞芳工業區88號,0,核准設立,2020-04-01 02:36:38.997
65495808,盲旅股份有限公司,臺北市南港區東新街80巷9弄1號2樓,1200000,核准設立,2020-04-01 02:36:38.997
65534648,達標實業有限公司,新北市汐止區新台五路1段77號11樓之1,0,核准設立,2020-04-01 02:36:38.997
65589609,宇立電子股份有限公司,臺北市文山區景文街42號3樓,5000000,核准設立,2020-04-01 02:36:38.997
65597571,康騰國際事業有限公司,新北市新店區中央六街78號3樓,0,解散,2020-04-01 02:36:38.997
65672867,天愛全球地產有限公司,新北市板橋區雙十路2段174號,0,核准設立,2020-04-01 02:36:38.997
65677770,沅沅有限公司,新北市三重區正義北路142號2樓,0,解散,2020-04-01 02:36:38.997
65679849,錦招文創開發有限公司,新北市三重區集美街126巷40號2樓,0,核准設立,2020-04-01 02:36:38.997
65717506,優護網仲平台國際有限公司,新北市土城區學府路1段129巷34號,0,核准設立,2020-04-01 02:36:38.997
65733203,貝揚凡斯有限公司,新北市中和區中正路957號5樓,null,核准設立,2020-04-01 02:36:38.997
65802714,善里社會企業有限公司,新北市汐止區新台五路1段159號11樓之3,0,解散,2020-04-01 02:36:38.997
65895608,台灣花菁汐生物科技有限公司,新北市五股區五權七路57號6樓,0,核准設立,2020-04-01 02:36:38.997
65903207,金邱爺有限公司,臺北市信義區松德路124號1樓,0,核准設立,2020-04-01 02:36:38.997
65906128,愛上路企業有限公司,新北市新莊區中正路700之31號6樓,0,解散,2020-04-01 02:36:38.997
65922909,捷勝土地開發股份有限公司,新北市中和區中正路700號8樓,6000000,廢止,2020-04-01 02:36:38.997
66009018,長實開發股份有限公司,新北市中和區景新街34巷2之3號,10300510,核准設立,2020-04-01 02:36:38.997
66251301,台灣亞太開發網路資訊有限公司,新北市板橋區南雅南路1段8號8樓之11,0,核准設立,2020-04-01 02:36:38.997
66253835,勵盈電子傳媒有限公司,新北市板橋區雙十路2段50號9樓,0,核准設立,2020-04-01 02:36:38.997
66253841,質政科技有限公司,新北市中和區景平路70號(1樓),0,核准設立,2020-04-01 02:36:38.997
66255854,祐碁動力國際股份有限公司,新北市板橋區民權路282號(1樓),2500000,解散,2020-04-01 02:36:38.997
66256191,子巧科學技術有限公司,新北市中和區中山路2段33號10樓之1,0,核准設立,2020-04-01 02:36:38.997
66258114,米坊國際貿易有限公司,新北市三重區大同北路221巷46弄7號(1樓),0,核准設立,2020-04-01 02:36:38.997
66260998,銳羿能源有限公司,新北市林口區文化三路1段617巷177號7樓,0,核准設立,2020-04-01 02:36:38.997
66262433,無極限創意行銷有限公司,新北市三重區大同南路7巷9號3樓,0,核准設立,2020-04-01 02:36:38.997
66263524,原博多媒體設計有限公司,新北市三芝區中興街1段35之1號8樓,0,核准設立,2020-04-01 02:36:38.997
66265924,歆儒懿有限公司,新北市深坑區北深路3段307號2樓,0,廢止,2020-04-01 02:36:38.997
66267964,享世紀國際股份有限公司,新北市中和區南山路236巷23弄2號,1000000,核准設立,2020-04-01 02:36:38.997
66289313,䕭蓳有限公司,新北市中和區中山路2段33號10樓之5,0,核准設立,2020-04-01 02:36:38.997
66290796,澐想數位科技有限公司,新北市新莊區豐盛一街16號6樓,0,核准設立,2020-04-01 02:36:38.997
66292990,百川系統有限公司,新北市汐止區仁愛路151巷6號5樓,0,核准設立,2020-04-01 02:36:38.997
66318078,承美管理顧問有限公司,新北市板橋區民權路202巷9弄60號,0,核准設立,2020-04-01 02:36:38.997
66318529,安吉思創新事業有限公司,臺北市大安區忠孝東路4段221號12樓,0,核准設立,2020-04-01 02:36:38.997
66318871,打雜幫股份有限公司,新北市三重區仁安街31號,1000000,核准設立,2020-04-01 02:36:38.997
66319273,資安律技術服務股份有限公司,臺北市松山區復興南路1段1號7樓之5,2000000,核准設立,2020-04-01 02:36:38.997
66319941,昱澄新農業有限公司,新北市鶯歌區國慶街115巷13弄13號(1樓),0,核准設立,2020-04-01 02:36:38.997
66322185,智妍云股份有限公司,新北市板橋區文化路2段182巷3弄68號7樓,1000000,解散,2020-04-01 02:36:38.997
66322805,傑恆國際貿易有限公司,新北市三峽區大觀路84號6樓,0,核准設立,2020-04-01 02:36:38.997
66335386,大朕節能有限公司,新北市三重區重新路3段97號2樓,0,核准設立,2020-04-01 02:36:38.997
66347670,御筋堂國際企業有限公司,新北市新店區安興路117號12樓之7,0,核准設立,2020-04-01 02:36:38.997
66352976,天愛房屋有限公司,新北市板橋區文化路2段19號,0,核准設立,2020-04-01 02:36:38.997
66354405,平庵股份有限公司,新北市汐止區宜興街40巷6號3樓,1200000,解散,2020-04-01 02:36:38.997
66357281,傲嬌文創有限公司,新北市中和區中正路681號13樓之5,0,核准設立,2020-04-01 02:36:38.997
66366893,誠瑜國際有限公司,新北市蘆洲區水湳街59號1樓,0,解散,2020-04-01 02:36:38.997
66367083,勢角行有限公司,新北市中和區仁愛街23之3號,0,核准設立,2020-04-01 02:36:38.997
66370587,研暘科技有限公司,新北市泰山區明志路3段145巷53弄16號(1樓),0,核准設立,2020-04-01 02:36:38.997
66372781,中信國際建築股份有限公司,新北市蘆洲區民族路422巷82弄15號,3000000,核准設立,2020-04-01 02:36:38.997
66377940,三蔥國際有限公司,新北市新店區民權路132號6樓,0,核准設立,2020-04-01 02:36:38.997
66380966,富茂國際有限公司,臺北市中山區長安東路2段181號6樓之3,0,核准設立,2020-04-01 02:36:38.997
66382182,微機四福有限公司,新北市三峽區介壽路3段179號,0,核准設立,2020-04-01 02:36:38.997
66391416,華上企業有限公司,新北市新莊區化成路746巷20號（1樓）,0,核准設立,2020-04-01 02:36:38.997
66391773,緯蕎科技有限公司,新北市三重區成功路110號2樓之2,0,核准設立,2020-04-01 02:36:38.997
66399016,維創興業有限公司,桃園市中壢區興安二街43號1樓,0,核准設立,2020-04-01 02:36:38.997
66400576,明磊有限公司,新北市五股區中興路1段151巷59號,0,核准設立,2020-04-01 02:36:38.997
66401619,倍思親國際有限公司,新北市新店區北宜路2段117之2號5樓,0,核准設立,2020-04-01 02:36:38.997
66401651,萌互動創意有限公司,新北市汐止區福德三路6號9樓之1,0,核准設立,2020-04-01 02:36:38.997
66409513,璽悅國際開發有限公司,新北市林口區文林一街115巷11-1號,0,核准設立,2020-04-01 02:36:38.997
66413544,佑佳網路有限公司,新北市板橋區雙十路2段10之1號4樓,0,核准設立,2020-04-01 02:36:38.997
66425204,觀天下管理顧問股份有限公司,臺北市內湖區瑞湖街103號7樓,5000000,核准設立,2020-04-01 02:36:38.997
66447832,登陽智慧科技股份有限公司,新北市三重區重新路5段609巷16號2樓之2,10000000,核准設立,2020-04-01 02:36:38.997
66447919,啟機科技有限公司,新北市汐止區福德一路50號5樓,0,核准設立,2020-04-01 02:36:38.997
66450322,進錠有限公司,新北市樹林區東豐街49巷22弄39號(1樓),0,核准設立,2020-04-01 02:36:38.997
66450553,青定事業有限公司,新北市板橋區文聖街229號,0,核准設立,2020-04-01 02:36:38.997
66451595,小集體科技有限公司,新北市中和區連城路268號4樓之9,0,核准設立,2020-04-01 02:36:38.997
66456803,藍星資訊有限公司,新北市三重區中正南路196號(1樓),0,核准設立,2020-04-01 02:36:38.997
66456917,般若國際貿易有限公司,新北市蘆洲區三民路368號19樓之2,0,核准設立,2020-04-01 02:36:38.997
66457063,冠焱科技有限公司,新北市淡水區學府路173號(1樓),0,核准設立,2020-04-01 02:36:38.997
66458056,左右物聯有限公司,新北市中和區中山路2段301之12號,0,解散,2020-04-01 02:36:38.997
66460341,鴻信國際物流有限公司,新北市板橋區縣民大道3段145號,0,核准設立,2020-04-01 02:36:38.997
66462729,揪探吉股份有限公司,新北市新店區安興路85之16號7樓,3000000,核准設立,2020-04-01 02:36:38.997
66463918,亞威社群行銷有限公司,新北市永和區成功路1段64巷4號(1樓),0,核准設立,2020-04-01 02:36:38.997
66466154,星煌數位娛樂有限公司,新北市中和區中山路2段301之21號,0,核准設立,2020-04-01 02:36:38.997
66466838,歐倍電子商務有限公司,新竹市中華路三段46號3樓,0,核准設立,2020-04-01 02:36:38.997
66468049,高深農特產品營銷服務有限公司,新北市新店區安德街18號5樓,0,解散,2020-04-01 02:36:38.997
66468532,麒莉國際有限公司,新北市新店區太平路20號6樓,0,核准設立,2020-04-01 02:36:38.997
66468786,樂活娛樂傳媒有限公司,桃園市桃園區埔新路1巷3之1號,0,核准設立,2020-04-01 02:36:38.997
66469814,冠亨起重有限公司,新北市中和區光華街31巷37號4樓,0,核准設立,2020-04-01 02:36:38.997
66478291,九鵬開發綠能科技有限公司,臺北市大安區忠孝東路4段169號11樓之4,0,核准設立,2020-04-01 02:36:38.997
66481937,逆轉科技有限公司,新北市三重區重新路5段609巷12號4樓,0,核准設立,2020-04-01 02:36:38.997
66483371,寰宇速匯股份有限公司,新北市新店區光明街98之1號9樓,26000000,核准設立,2020-04-01 02:36:38.997
66483386,捷叡科技應用有限公司,新北市中和區連城路350之1號(2樓),0,核准設立,2020-04-01 02:36:38.997
66484006,廣緣顧問有限公司,新北市新莊區中正路708之2號3樓,0,解散,2020-04-01 02:36:38.997
66486742,鴻業國際有限公司,新北市新莊區頭前路113號9樓,0,核准設立,2020-04-01 02:36:38.997
66488066,富太健康服務有限公司,新北市中和區中山路3段35號10樓之3,0,核准設立，但已命令解散,2020-04-01 02:36:38.997
66491941,勵盈融通股份有限公司,新北市林口區中山路679號5樓之3,500000,核准設立,2020-04-01 02:36:38.997
66505728,瑋創興業有限公司,新北市中和區連城路99巷11號12樓,0,核准設立,2020-04-01 02:36:38.997
66508788,曜莘管理顧問股份有限公司,新北市中和區中正路788之1號12樓,6200000,核准設立,2020-04-01 02:36:38.997
66509061,英文科技有限公司,新北市中和區中興街161巷6弄5號,0,核准設立,2020-04-01 02:36:38.997
66510383,實大創新科技行銷有限公司,新北市三重區中正北路315巷6弄55號,0,核准設立,2020-04-01 02:36:38.997
66511398,翔姿生技股份有限公司,新北市土城區裕民路259巷1之3號12樓,200000,解散,2020-04-01 02:36:38.997
66517338,長元國際有限公司,新北市鶯歌區建國路126號10樓之3,0,核准設立,2020-04-01 02:36:38.997
66521017,旺珍有限公司,新北市中和區橋和路160巷27號2樓,0,核准設立,2020-04-01 02:36:38.997
66521430,紅映數位製作有限公司,新北市汐止區汐萬路2段245巷13號(1樓),0,核准設立,2020-04-01 02:36:38.997
66525127,微點創意有限公司,新北市汐止區瑞松街194巷11號,0,核准設立,2020-04-01 02:36:38.997
66527390,海公主國際股份有限公司,臺北市松山區南京東路4段171號6樓之2,5000000,核准設立,2020-04-01 02:36:38.997
66527700,台灣預約有限公司,新北市中和區景平路385巷47之3號,0,解散,2020-04-01 02:36:38.997
66527954,點點網絡股份有限公司,新北市三重區重新路4段97號11樓之2,15000000,核准設立,2020-04-01 02:36:38.997
66529427,淳品有限公司,新北市新莊區中信街68樓3樓之10,0,核准設立,2020-04-01 02:36:38.997
66532627,和事實業有限公司,新北市中和區保健路50巷56號3樓,0,核准設立,2020-04-01 02:36:38.997
66533787,渼庭有限公司,新北市新莊區西盛街153巷3號7樓,0,核准設立,2020-04-01 02:36:38.997
66536980,緣創智略科技股份有限公司,新北市新店區永業路81巷14號3樓,250000,解散,2020-04-01 02:36:38.997
66543841,捷瑞行銷有限公司,新北市三重區中興北街180巷21弄7號,0,核准設立,2020-04-01 02:36:38.997
66544861,寬電有限公司,新北市中和區和平街23號(1、2樓),0,解散,2020-04-01 02:36:38.997
66545685,台灣車聯科技有限公司,新北市三重區中正南路242號(1樓),0,核准設立,2020-04-01 02:36:38.997
66546283,薇爾熙有限公司,新北市樹林區柑園街1段196號,0,解散,2020-04-01 02:36:38.997
66548347,安芹國際有限公司,新北市三重區重新路5段609巷14號之9,0,解散,2020-04-01 02:36:38.997
66548466,唐翰有限公司,新北市新店區中正路503號4樓,0,核准設立,2020-04-01 02:36:38.997
66549346,潤海國際有限公司,新北市中和區中正路292號2樓,0,核准設立,2020-04-01 02:36:38.997
66549922,攸諾雅國際有限公司,新北市林口區文化三路1段101號,0,解散,2020-04-01 02:36:38.997
66550602,盛達勝國際企業有限公司,臺中市北區賴興里梅川西路四段227號5樓之2,0,核准設立,2020-04-01 02:36:38.997
66553592,天寶年華生物科技有限公司,臺北市大安區忠孝東路3段305號6樓之1,0,核准設立,2020-04-01 02:36:38.997
66554608,多利微創有限公司,新北市汐止區福德一路272巷16號,0,核准設立,2020-04-01 02:36:38.997
66555563,蓓芙琳有限公司,新北市中和區景新街467巷35弄8之2號(3樓),0,核准設立,2020-04-01 02:36:38.997
66555655,鐳刻創憶行銷有限公司,新北市三重區福德南路20號5樓,0,核准設立,2020-04-01 02:36:38.997
66556872,宏雅科技有限公司,新北市板橋區文化路1段368號18樓之10,0,核准設立,2020-04-01 02:36:38.997
66557794,旭黑富源資訊有限公司,新北市樹林區三龍街115號,0,核准設立,2020-04-01 02:36:38.997
66557817,智鈞興業有限公司,新北市中和區景安路82巷1之1號,0,核准設立,2020-04-01 02:36:38.997
66568928,房角石室內設計有限公司,新北市新莊區中正路694巷12號3樓,0,核准設立,2020-04-01 02:36:38.997
66569320,佳晏有限公司,新北市中和區忠孝街58巷24號(1樓),0,核准設立,2020-04-01 02:36:38.997
66569882,勝璟國際股份有限公司,新北市林口區忠孝一路76號,7000000,核准設立,2020-04-01 02:36:38.997
66571640,佳影數據整合股份有限公司,新北市新店區寶強路6之3號5樓,5000000,核准設立,2020-04-01 02:36:38.997
66571917,台灣集合網有限公司,新北市板橋區滿平街84巷110弄21之1號,0,核准設立,2020-04-01 02:36:38.997
66572227,池安科技股份有限公司,臺北市松山區民生東路3段128號3樓,7820000,核准設立,2020-04-01 02:36:38.997
66572845,彥霖科技有限公司,新北市蘆洲區永安南路2段352號3樓,0,解散,2020-04-01 02:36:38.997
66573963,煋宇生技股份有限公司,新北市中和區板南路655號5樓,10460000,核准設立,2020-04-01 02:36:38.997
66575414,榮鑫物流有限公司,新北市三峽區民生街19巷7弄2號2樓,0,解散,2020-04-01 02:36:38.997
66577686,旺達富股份有限公司,新北市汐止區新台五路1段108號14樓,5000000,解散,2020-04-01 02:36:38.997
66578101,聯網網絡科技有限公司,新北市汐止區湖前街110巷97弄3號,0,核准設立,2020-04-01 02:36:38.997
66579621,明瀚科技股份有限公司,新北市三重區重新路4段97號30樓之1,3000000,核准設立,2020-04-01 02:36:38.997
66582386,綠工環創股份有限公司,新北市三重區成功路100號14樓之7,2000000,核准設立,2020-04-01 02:36:38.997
66583884,巨鑫科技股份有限公司,新北市淡水區淡金路16巷71號6樓,26000000,核准設立,2020-04-01 02:36:38.997
66585308,星間飛行有限公司,新北市三重區大勇街46號(1樓),0,廢止,2020-04-01 02:36:38.997
66586453,台灣微盟信息科技有限公司,新北市新莊區立信一街10巷12號12樓,0,核准設立,2020-04-01 02:36:38.997
66587761,欣班客企業有限公司,新北市中和區中正路872號5樓,0,核准設立,2020-04-01 02:36:38.997
66589629,洲際黑膠會社有限公司,新北市中和區圓通路176號（1樓）,0,解散,2020-04-01 02:36:38.997
66590479,找美學有限公司,新北市板橋區金華街21巷15號,0,解散,2020-04-01 02:36:38.997
66591619,駿侖整合行銷有限公司,新北市土城區慶安街45巷10號(1樓),0,核准設立,2020-04-01 02:36:38.997
66594860,成達國際有限公司,臺北市松山區南京東路5段123巷15號1樓,0,核准設立,2020-04-01 02:36:38.997
66599112,六杉品牌設計有限公司,新北市汐止區福德一路405巷16號（2樓）,0,核准設立,2020-04-01 02:36:38.997
66601052,育人商業顧問有限公司,臺北市中正區重慶南路1段57號7樓,0,核准設立,2020-04-01 02:36:38.997
66601320,康普智能科技股份有限公司,新北市中和區中和路196巷3號,100000,解散,2020-04-01 02:36:38.997
66602593,富國春企管顧問有限公司,新北市板橋區漢生東路145之2號,0,核准設立,2020-04-01 02:36:38.997
66602904,普雷迪克財富管理顧問有限公司,新北市淡水區北新路182巷5弄2號5樓,0,廢止,2020-04-01 02:36:38.997
66603869,富利寰旅資訊科技有限公司,臺北市中山區敬業一路128巷41號6樓之5,0,核准設立,2020-04-01 02:36:38.997
66604121,玄樂客國際有限公司,新北市三峽區大同路194號12樓,0,核准設立,2020-04-01 02:36:38.997
66605682,艾思薇策略行銷有限公司,新北市林口區文化一路1段102號,0,核准設立,2020-04-01 02:36:38.997
66607963,創意門有限公司,新北市林口區麗園一街2巷2號11樓之1,0,核准設立,2020-04-01 02:36:38.997
66608436,大衛網路商城有限公司,新北市深坑區北深路3段274號6樓,0,核准設立,2020-04-01 02:36:38.997
66608962,捷力國際有限公司,新北市三峽區介壽路1段269號,0,核准設立,2020-04-01 02:36:38.997
66609651,唯翔數位科技有限公司,新北市永和區保生路1號15樓之3,0,核准設立,2020-04-01 02:36:38.997
66610995,艾德森國際企業有限公司,新北市五股區四維路104巷6號,0,核准設立,2020-04-01 02:36:38.997
66613183,康莊資產開發股份有限公司,新北市土城區中央路4段2號6樓之3,200000000,核准設立,2020-04-01 02:36:38.997
66613780,黑虎有限公司,臺北市中山區中山北路1段84號13樓之6,0,核准設立,2020-04-01 02:36:38.997
66614388,有辦法創新有限公司,新北市新莊區天祥街54巷3弄12號(1樓),0,核准設立,2020-04-01 02:36:38.997
66614839,雷霆數位科技娛樂股份有限公司,新北市汐止區新台五路1段79號3樓之11,15000000,核准設立,2020-04-01 02:36:38.997
66615437,創易連網資訊股份有限公司,新北市汐止區新台五路1段97號19樓之7,7000000,核准設立,2020-04-01 02:36:38.997
66615730,台灣狼爪股份有限公司,新北市三重區秀江街89號,60000,解散,2020-04-01 02:36:38.997
66615936,維沃股份有限公司,臺北市內湖區瑞湖街103號7樓,6000000,核准設立,2020-04-01 02:36:38.997
66616034,億全聚網路科技有限公司,新北市新莊區天祥街32號5樓,0,核准設立,2020-04-01 02:36:38.997
66616750,荷馬國際有限公司,新北市林口區八德路242號11樓,0,核准設立,2020-04-01 02:36:38.997
66618286,同洲有限公司,新北市板橋區雙十路2段70巷25號(1樓),0,核准設立,2020-04-01 02:36:38.997
66619525,虹朵整合設計有限公司,新北市三重區三和路4段163巷90之3號,0,核准設立,2020-04-01 02:36:38.997
66620760,歐森資訊科技有限公司,新北市中和區錦和路93巷4弄9號,0,核准設立,2020-04-01 02:36:38.997
66620966,台奧國際有限公司,臺北市中山區南京東路2段95號11樓,0,核准設立,2020-04-01 02:36:38.997
66621493,光環星網有限公司,新北市板橋區四川路2段245巷35號4樓,0,核准設立,2020-04-01 02:36:38.997
66624745,滙飛有限公司,新北市新店區民權路105號5樓,0,核准設立,2020-04-01 02:36:38.997
66625408,豪業科技有限公司,臺北市大安區忠孝東路4段221號12樓,0,核准設立,2020-04-01 02:36:38.997
66625673,鑫遠科技有限公司,新北市中和區景平路268號6樓之5,0,解散,2020-04-01 02:36:38.997
66626173,全球通生活事業有限公司,新北市中和區中正路691號,0,核准設立,2020-04-01 02:36:38.997
66626259,瀧信資訊有限公司,新北市泰山區明志路2段400巷4號,0,核准設立,2020-04-01 02:36:38.997
66626363,合勤健康事業股份有限公司,新北市新莊區新北大道4段179號18樓之5,50000000,核准設立,2020-04-01 02:36:38.997
66627721,天空創客股份有限公司,新北市中和區橋和路115號8樓,2000000,解散,2020-04-01 02:36:38.997
66628600,珈晟企業管理顧問有限公司,新北市汐止區伯爵街96巷11號3樓,0,核准設立,2020-04-01 02:36:38.997
66630021,宸欣工程有限公司,新北市中和區忠孝街26巷75號,0,解散,2020-04-01 02:36:38.997
66630649,敏修企業有限公司,新北市中和區復興路301巷29之2號(3樓),0,核准設立,2020-04-01 02:36:38.997
